price,name,image,url,description,brand,rating,rating_count,rating_best,categories,health_consideration,animal_type,animal_lifestage,animal_size,size_value,size_unit,size_merged
10.19,Hagen Rabbit Pellets,https://s7d2.scene7.com/is/image/PetSmart/1051184,https://www.petsmart.ca/small-pet/food-treats-and-hay/food/hagen-rabbit-pellets-1051184.html,Hagen Rabbit Pellets,Hagen,2.8333,6,5,"Food, Treats &amp; Hay|Food|",,small pet,,,5.0,Lb,5 Lb
13.59,Oxbow Essentials Chinchilla Food,https://s7d2.scene7.com/is/image/PetSmart/5251724,https://www.petsmart.ca/small-pet/food-treats-and-hay/food/oxbow-essentials-chinchilla-food-5251724.html,Oxbow Essentials Chinchilla Food,Oxbow,4.8571,28,5,"Food, Treats &amp; Hay|Food|",,small pet,,,3.0,Lb,3 Lb
16.99,Living World® Extrusion Diet Rabbit Food,https://s7d2.scene7.com/is/image/PetSmart/5088532,https://www.petsmart.ca/small-pet/food-treats-and-hay/food/living-world-extrusion-diet-rabbit-food-5088532.html,Living World&reg; Extrusion Diet Rabbit Food,Living World,3.6667,3,5,"Food, Treats &amp; Hay|Food|",,small pet,,,3.0,Lb,3 Lb
8.91,Little Friends Hamster &amp; Gerbil Food,https://s7d2.scene7.com/is/image/PetSmart/5299555,https://www.petsmart.ca/small-pet/food-treats-and-hay/food/little-friends-hamster-and-gerbil-food-5299555.html,Little Friends Hamster &amp; Gerbil Food,Little Friends,4.5,2,5,"Food, Treats &amp; Hay|Food|",,small pet,,,500.0,g,500 g
11.04,Hagen Hamster &amp; Gerbil Mix Food,https://s7d2.scene7.com/is/image/PetSmart/1051189,https://www.petsmart.ca/small-pet/food-treats-and-hay/food/hagen-hamster-and-gerbil-mix-food-1051189.html,Hagen Hamster &amp; Gerbil Mix Food,Hagen,4.5,2,5,"Food, Treats &amp; Hay|Food|",,small pet,,,2.5,Lb,2.5 Lb
13.59,Little Friends Timothy Adult Rabbit Food,https://s7d2.scene7.com/is/image/PetSmart/5299558,https://www.petsmart.ca/small-pet/food-treats-and-hay/food/little-friends-timothy-adult-rabbit-food-5299558.html,Little Friends Timothy Adult Rabbit Food,Little Friends,4.25,8,5,"Food, Treats &amp; Hay|Food|",,small pet,,,2.0,kg,2 kg
12.74,Mazuri Rat &amp; Mouse Food,https://s7d2.scene7.com/is/image/PetSmart/5328148,https://www.petsmart.ca/small-pet/food-treats-and-hay/food/mazuri-rat-and-mouse-food-5328148.html,Mazuri Rat &amp; Mouse Food,Mazuri,4.7917,24,5,"Food, Treats &amp; Hay|Food|",,small pet,,,2.0,Lb,2 Lb
33.99,Brown&#x27;s® Tropical Carnival® Gourmet Rabbit Food,https://s7d2.scene7.com/is/image/PetSmart/5175721,https://www.petsmart.ca/small-pet/food-treats-and-hay/food/browns-tropical-carnival-gourmet-rabbit-food-5175721.html,Brown's&reg; Tropical Carnival&reg; Gourmet Rabbit Food,Brown's,4.3333,36,5,"Food, Treats &amp; Hay|Food|",,small pet,,,10.0,Lb,10 Lb
11.89,Hagen Guinea Pig Pellets,https://s7d2.scene7.com/is/image/PetSmart/1051186,https://www.petsmart.ca/small-pet/food-treats-and-hay/food/hagen-guinea-pig-pellets-1051186.html,Hagen Guinea Pig Pellets,Hagen,4.5,4,5,"Food, Treats &amp; Hay|Food|",,small pet,,,5.0,Lb,5 Lb
8.49,Vitakraft® Vita Smart Complete Nutrition Natural Forage Blend Hamster Food,https://s7d2.scene7.com/is/image/PetSmart/5298113,https://www.petsmart.ca/small-pet/food-treats-and-hay/food/vitakraft-vita-smart-complete-nutrition-natural-forage-blend-hamster-food-5298113.html,Vitakraft&reg; Vita Smart Complete Nutrition Natural Forage Blend Hamster Food,Vitakraft,4.4194,31,5,"Food, Treats &amp; Hay|Food|",,small pet,,,2.0,Lb,2 Lb
20.39,Brown&#x27;s® Tropical Carnival® Gourmet Guinea Pig Food,https://s7d2.scene7.com/is/image/PetSmart/5145307,https://www.petsmart.ca/small-pet/food-treats-and-hay/food/browns-tropical-carnival-gourmet-guinea-pig-food-5145307.html,Brown's&reg; Tropical Carnival&reg; Gourmet Guinea Pig Food,Brown's,4.05,40,5,"Food, Treats &amp; Hay|Food|",,small pet,,,5.0,Lb,5 Lb
15.29,Oxbow Essentials Adult Rat Food,https://s7d2.scene7.com/is/image/PetSmart/5173695,https://www.petsmart.ca/small-pet/food-treats-and-hay/food/oxbow-essentials-adult-rat-food-5173695.html,Oxbow Essentials Adult Rat Food,Oxbow,4.7867,75,5,"Food, Treats &amp; Hay|Food|",,small pet,,,3.0,Lb,3 Lb
19.54,Full Cheeks&amp;trade; Guinea Pig Foraging Diet,https://s7d2.scene7.com/is/image/PetSmart/5339536,https://www.petsmart.ca/small-pet/food-treats-and-hay/food/full-cheeksandtrade-guinea-pig-foraging-diet-5339536.html,Full Cheeks&amp;trade; Guinea Pig Foraging Diet,Full Cheeks,4.7576,33,5,"Food, Treats &amp; Hay|Food|",,small pet,,,8.0,Lb,8 Lb
13.59,Full Cheeks&amp;trade; Rabbit Pelleted Diet,https://s7d2.scene7.com/is/image/PetSmart/5339544,https://www.petsmart.ca/small-pet/food-treats-and-hay/food/full-cheeksandtrade-rabbit-pelleted-diet-5339544.html,Full Cheeks&amp;trade; Rabbit Pelleted Diet,Full Cheeks,3.4286,7,5,"Food, Treats &amp; Hay|Food|",,small pet,,,5.0,Lb,5 Lb
16.99,Living World Green Botanicals Adult Guinea Pig Food,https://s7d2.scene7.com/is/image/PetSmart/5299348,https://www.petsmart.ca/small-pet/food-treats-and-hay/food/living-world-green-botanicals-adult-guinea-pig-food-5299348.html,Living World Green Botanicals Adult Guinea Pig Food,Living World,,0,5,"Food, Treats &amp; Hay|Food|",,small pet,,,3.0,Lb,3 Lb
8.49,Full Cheeks&amp;trade; Hamster &amp; Gerbil Foraging Diet,https://s7d2.scene7.com/is/image/PetSmart/5339539,https://www.petsmart.ca/small-pet/food-treats-and-hay/food/full-cheeksandtrade-hamster-and-gerbil-foraging-diet-5339539.html,Full Cheeks&amp;trade; Hamster &amp; Gerbil Foraging Diet,Full Cheeks,4.7368,38,5,"Food, Treats &amp; Hay|Food|",,small pet,,,2.0,Lb,2 Lb
19.54,Full Cheeks&amp;trade; Rabbit Foraging Diet,https://s7d2.scene7.com/is/image/PetSmart/5339542,https://www.petsmart.ca/small-pet/food-treats-and-hay/food/full-cheeksandtrade-rabbit-foraging-diet-5339542.html,Full Cheeks&amp;trade; Rabbit Foraging Diet,Full Cheeks,4.8235,34,5,"Food, Treats &amp; Hay|Food|",,small pet,,,8.0,Lb,8 Lb
13.59,Oxbow Essentials Young Rabbit Food,https://s7d2.scene7.com/is/image/PetSmart/5233390,https://www.petsmart.ca/small-pet/food-treats-and-hay/food/oxbow-essentials-young-rabbit-food-5233390.html,Oxbow Essentials Young Rabbit Food,Oxbow,4.7419,62,5,"Food, Treats &amp; Hay|Food|",,small pet,,,5.0,Lb,5 Lb
15.29,Oxbow Garden Select Adult Guinea Pig Food,https://s7d2.scene7.com/is/image/PetSmart/5266940,https://www.petsmart.ca/small-pet/food-treats-and-hay/food/oxbow-garden-select-adult-guinea-pig-food-5266940.html,Oxbow Garden Select Adult Guinea Pig Food,Oxbow,4.8846,26,5,"Food, Treats &amp; Hay|Food|",,small pet,,,4.0,Lb,4 Lb
34.84,Brown&#x27;s® Tropical Carnival® Gourmet Guinea Pig Food,https://s7d2.scene7.com/is/image/PetSmart/5175720,https://www.petsmart.ca/small-pet/food-treats-and-hay/food/browns-tropical-carnival-gourmet-guinea-pig-food-5175720.html,Brown's&reg; Tropical Carnival&reg; Gourmet Guinea Pig Food,Brown's,4.0,25,5,"Food, Treats &amp; Hay|Food|",,small pet,,,10.0,Lb,10 Lb
11.04,Little Friends Original Rabbit Food,https://s7d2.scene7.com/is/image/PetSmart/5300553,https://www.petsmart.ca/small-pet/food-treats-and-hay/food/little-friends-original-rabbit-food-5300553.html,Little Friends Original Rabbit Food,Little Friends,4.5263,19,5,"Food, Treats &amp; Hay|Food|",,small pet,,,2.0,kg,2 kg
13.59,Oxbow Essentials Adult Rabbit Food,https://s7d2.scene7.com/is/image/PetSmart/5134287,https://www.petsmart.ca/small-pet/food-treats-and-hay/food/oxbow-essentials-adult-rabbit-food-5134287.html,Oxbow Essentials Adult Rabbit Food,Oxbow,4.7679,168,5,"Food, Treats &amp; Hay|Food|",,small pet,,,5.0,Lb,5 Lb
20.39,Brown&#x27;s® Tropical Carnival® Natural Behaviors Grain-Free Rabbit Food,https://s7d2.scene7.com/is/image/PetSmart/5297984,https://www.petsmart.ca/small-pet/food-treats-and-hay/food/browns-tropical-carnival-natural-behaviors-grain-free-rabbit-food-5297984.html,Brown's&reg; Tropical Carnival&reg; Natural Behaviors Grain-Free Rabbit Food,Brown's,4.5909,22,5,"Food, Treats &amp; Hay|Food|",,small pet,,,4.0,Lb,4 Lb
21.24,Vitakraft® Vita Smart Complete Nutrition Natural Forage Blend Guinea Pig Food,https://s7d2.scene7.com/is/image/PetSmart/5298107,https://www.petsmart.ca/small-pet/food-treats-and-hay/food/vitakraft-vita-smart-complete-nutrition-natural-forage-blend-guinea-pig-food-5298107.html,Vitakraft&reg; Vita Smart Complete Nutrition Natural Forage Blend Guinea Pig Food,Vitakraft,4.7447,47,5,"Food, Treats &amp; Hay|Food|",,small pet,,,8.0,Lb,8 Lb
16.99,Science Selective House Rabbit Food,https://s7d2.scene7.com/is/image/PetSmart/5313679,https://www.petsmart.ca/small-pet/food-treats-and-hay/food/science-selective-house-rabbit-food-5313679.html,Science Selective House Rabbit Food,Science Selective,4.5,12,5,"Food, Treats &amp; Hay|Food|",,small pet,,,,,One Size
15.29,Oxbow Essentials Mouse &amp; Young Rat Food,https://s7d2.scene7.com/is/image/PetSmart/5200445,https://www.petsmart.ca/small-pet/food-treats-and-hay/food/oxbow-essentials-mouse-and-young-rat-food-5200445.html,Oxbow Essentials Mouse &amp; Young Rat Food,Oxbow,4.6875,16,5,"Food, Treats &amp; Hay|Food|",,small pet,,,2.5,Lb,2.5 Lb
16.99,Living World® Extrusion Diet Guinea Pig Food,https://s7d2.scene7.com/is/image/PetSmart/5088536,https://www.petsmart.ca/small-pet/food-treats-and-hay/food/living-world-extrusion-diet-guinea-pig-food-5088536.html,Living World&reg; Extrusion Diet Guinea Pig Food,Living World,5.0,2,5,"Food, Treats &amp; Hay|Food|",,small pet,,,3.0,Lb,3 Lb
16.99,Oxbow Essentials Adult Guinea Pig Food,https://s7d2.scene7.com/is/image/PetSmart/5134194,https://www.petsmart.ca/small-pet/food-treats-and-hay/food/oxbow-essentials-adult-guinea-pig-food-5134194.html,Oxbow Essentials Adult Guinea Pig Food,Oxbow,4.8218,174,5,"Food, Treats &amp; Hay|Food|",,small pet,,,5.0,Lb,5 Lb
16.99,Living World Green Botanicals Adult Rabbit Food,https://s7d2.scene7.com/is/image/PetSmart/5299350,https://www.petsmart.ca/small-pet/food-treats-and-hay/food/living-world-green-botanicals-adult-rabbit-food-5299350.html,Living World Green Botanicals Adult Rabbit Food,Living World,5.0,1,5,"Food, Treats &amp; Hay|Food|",,small pet,,,3.0,Lb,3 lb
66.99,Royal Canin Feline Health Nutrition Aging Spayed / Neutered 12+ Dry Adult Cat Food,https://s7d2.scene7.com/is/image/PetSmart/5345538,https://www.petsmart.ca/cat/food-and-treats/dry-food/royal-canin-feline-health-nutrition-aging-spayed-%2F-neutered-12%2B-dry-adult-cat-food-5345538.html,Royal Canin Feline Health Nutrition Aging Spayed / Neutered 12+ Dry Adult Cat Food,Royal Canin,4.9091,22,5,Food &amp; Treats|Dry Food|,,cat,,,7.0,Lb,7 Lb
34.99,"Natural Balance Indoor Adult Cat Broth Coated Kibble - Wheat &amp; Soy free, Chicken &amp; Salmon",https://s7d2.scene7.com/is/image/PetSmart/5346272,https://www.petsmart.ca/cat/food-and-treats/dry-food/natural-balance-indoor-adult-cat-broth-coated-kibble---wheat-and-soy-free-chicken-and-salmon-5346272.html,"Natural Balance Indoor Adult Cat Broth Coated Kibble - Wheat &amp; Soy free, Chicken &amp; Salmon",Natural Balance,,0,5,Food &amp; Treats|Dry Food|,,cat,,,6.0,Lb,6 Lb
34.99,"Natural Balance Indoor Adult Cat Broth Coated Kibble - Wheat, Soy &amp; Grain Free, Chicken &amp; Salmon",https://s7d2.scene7.com/is/image/PetSmart/5346271,https://www.petsmart.ca/cat/food-and-treats/dry-food/natural-balance-indoor-adult-cat-broth-coated-kibble---wheat-soy-and-grain-free-chicken-and-salmon-5346271.html,"Natural Balance Indoor Adult Cat Broth Coated Kibble - Wheat, Soy &amp; Grain Free, Chicken &amp; Salmon",Natural Balance,,0,5,Food &amp; Treats|Dry Food|,,cat,,,6.0,Lb,6 Lb
38.99,Royal Canin Feline Health Nutrition Fit And Active Dry Adult Cat Food,https://s7d2.scene7.com/is/image/PetSmart/5345503,https://www.petsmart.ca/cat/food-and-treats/dry-food/royal-canin-feline-health-nutrition-fit-and-active-dry-adult-cat-food-5345503.html,Royal Canin Feline Health Nutrition Fit And Active Dry Adult Cat Food,Royal Canin,4.8667,45,5,Food &amp; Treats|Dry Food|,,cat,,,3.0,Lb,3 Lb
39.99,Authority® Hairball Control &amp; Healthy Weight Cat Dry Food - Chicken &amp; Rice Formula,https://s7d2.scene7.com/is/image/PetSmart/5342262,https://www.petsmart.ca/cat/food-and-treats/dry-food/authority-hairball-control-and-healthy-weight-cat-dry-food---chicken-and-rice-formula-5342262.html,Authority&reg; Hairball Control &amp; Healthy Weight Cat Dry Food - Chicken &amp; Rice Formula,Authority,5.0,1,5,Food &amp; Treats|Dry Food|,,cat,,,7.0,Lb,7 Lb
54.99,Purina Pro Plan Vital Systems Cat Food - Chicken &amp; Egg Formula 5LB,https://s7d2.scene7.com/is/image/PetSmart/5337935,https://www.petsmart.ca/cat/food-and-treats/dry-food/purina-pro-plan-vital-systems-cat-food---chicken-and-egg-formula-5lb-5337935.html,Purina Pro Plan Vital Systems Cat Food - Chicken &amp; Egg Formula 5LB,Purina Pro Plan,4.7143,126,5,Food &amp; Treats|Dry Food|,,cat,,,5.0,Lb,5 Lb
64.99,Authority® Hairball Control &amp; Healthy Weight Cat Dry Food - Chicken &amp; Rice Formula,https://s7d2.scene7.com/is/image/PetSmart/5342261,https://www.petsmart.ca/cat/food-and-treats/dry-food/authority-hairball-control-and-healthy-weight-cat-dry-food---chicken-and-rice-formula-5342261.html,Authority&reg; Hairball Control &amp; Healthy Weight Cat Dry Food - Chicken &amp; Rice Formula,Authority,,0,5,Food &amp; Treats|Dry Food|,,cat,,,16.0,Lb,16 Lb
54.99,Purina Pro Plan Vital Systems Cat Food - Salmon &amp; Egg Formula 5LB,https://s7d2.scene7.com/is/image/PetSmart/5337936,https://www.petsmart.ca/cat/food-and-treats/dry-food/purina-pro-plan-vital-systems-cat-food---salmon-and-egg-formula-5lb-5337936.html,Purina Pro Plan Vital Systems Cat Food - Salmon &amp; Egg Formula 5LB,Purina Pro Plan,4.8125,96,5,Food &amp; Treats|Dry Food|,,cat,,,5.0,Lb,5 Lb
29.99,Purina Pro Plan Vital Systems Chicken Adult Cat 3LB,https://s7d2.scene7.com/is/image/PetSmart/5337932,https://www.petsmart.ca/cat/food-and-treats/dry-food/purina-pro-plan-vital-systems-chicken-adult-cat-3lb-5337932.html,Purina Pro Plan Vital Systems Chicken Adult Cat 3LB,Purina Pro Plan,4.7698,126,5,Food &amp; Treats|Dry Food|,,cat,,,3.0,Lb,3 Lb
69.99,Royal Canin Feline Care Nutrition Hair &amp; Skin Care Adult Dry Cat Food - Chicken,https://s7d2.scene7.com/is/image/PetSmart/5345540,https://www.petsmart.ca/cat/food-and-treats/dry-food/royal-canin-feline-care-nutrition-hair-and-skin-care-adult-dry-cat-food---chicken-5345540.html,Royal Canin Feline Care Nutrition Hair &amp; Skin Care Adult Dry Cat Food - Chicken,Royal Canin,4.6316,38,5,Food &amp; Treats|Dry Food|,,cat,,,7.0,Lb,7 Lb
66.99,Royal Canin Feline Health Nutrition Fit and Active Dry Adult Cat Food,https://s7d2.scene7.com/is/image/PetSmart/5344852,https://www.petsmart.ca/cat/food-and-treats/dry-food/royal-canin-feline-health-nutrition-fit-and-active-dry-adult-cat-food-5344852.html,Royal Canin Feline Health Nutrition Fit and Active Dry Adult Cat Food,Royal Canin,4.8723,47,5,Food &amp; Treats|Dry Food|,,cat,,,7.0,Lb,7 Lb
66.99,Royal Canin Feline Health Nutrition Indoor Long Hair Dry Cat Food,https://s7d2.scene7.com/is/image/PetSmart/5344823,https://www.petsmart.ca/cat/food-and-treats/dry-food/royal-canin-feline-health-nutrition-indoor-long-hair-dry-cat-food-5344823.html,Royal Canin Feline Health Nutrition Indoor Long Hair Dry Cat Food,Royal Canin,4.7083,24,5,Food &amp; Treats|Dry Food|,,cat,,,6.0,Lb,6 Lb
66.99,Royal Canin Savor Selective Dry Cat Food 6LB,https://s7d2.scene7.com/is/image/PetSmart/5344185,https://www.petsmart.ca/cat/food-and-treats/dry-food/royal-canin-savor-selective-dry-cat-food-6lb-5344185.html,Royal Canin Savor Selective Dry Cat Food 6LB,Royal Canin,4.75,64,5,Food &amp; Treats|Dry Food|,,cat,,,6.0,Lb,6 Lb
68.99,Royal Canin Siamese Dry Cat Food 6LB,https://s7d2.scene7.com/is/image/PetSmart/5344187,https://www.petsmart.ca/cat/food-and-treats/dry-food/royal-canin-siamese-dry-cat-food-6lb-5344187.html,Royal Canin Siamese Dry Cat Food 6LB,Royal Canin,4.6518,112,5,Food &amp; Treats|Dry Food|,,cat,,,6.0,Lb,6 Lb
66.99,Royal Canin Indoor 7+ Dry Cat Food 5.5LB,https://s7d2.scene7.com/is/image/PetSmart/5343924,https://www.petsmart.ca/cat/food-and-treats/dry-food/royal-canin-indoor-7%2B-dry-cat-food-5.5lb-5343924.html,Royal Canin Indoor 7+ Dry Cat Food 5.5LB,Royal Canin,4.4179,67,5,Food &amp; Treats|Dry Food|,,cat,,,5.5,Lb,5.5 Lb
68.99,Royal Canin Ragdoll Dry Cat Food 7LB,https://s7d2.scene7.com/is/image/PetSmart/5344186,https://www.petsmart.ca/cat/food-and-treats/dry-food/royal-canin-ragdoll-dry-cat-food-7lb-5344186.html,Royal Canin Ragdoll Dry Cat Food 7LB,Royal Canin,4.7303,89,5,Food &amp; Treats|Dry Food|,,cat,,,7.0,Lb,7 Lb
68.99,Royal Canin Bengal Adult Cat Food 7LB,https://s7d2.scene7.com/is/image/PetSmart/5344189,https://www.petsmart.ca/cat/food-and-treats/dry-food/-royal-canin-bengal-adult-cat-food-7lb-5344189.html, Royal Canin Bengal Adult Cat Food 7LB,Royal Canin,4.6415,53,5,Food &amp; Treats|Dry Food|,,cat,,,7.0,Lb,7 Lb
19.49,"BLUE Tastefuls Adult Dry Cat Food - Weight &amp; Hairball Control, Natural, Chicken &amp; Brown Rice",https://s7d2.scene7.com/is/image/PetSmart/5343942,https://www.petsmart.ca/cat/food-and-treats/dry-food/blue-tastefuls-adult-dry-cat-food---weight-and-hairball-control-natural-chicken-and-brown-rice-5343942.html,"BLUE Tastefuls Adult Dry Cat Food - Weight &amp; Hairball Control, Natural, Chicken &amp; Brown Rice",Blue Buffalo,4.7685,216,5,Food &amp; Treats|Dry Food|,,cat,,,3.0,Lb,3 Lb
19.49,"BLUE Tastefuls Senior Dry Cat Food - Chicken &amp; Brown Rice, Natural",https://s7d2.scene7.com/is/image/PetSmart/5343388,https://www.petsmart.ca/cat/food-and-treats/dry-food/blue-tastefuls-senior-dry-cat-food---chicken-and-brown-rice-natural-5343388.html,"BLUE Tastefuls Senior Dry Cat Food - Chicken &amp; Brown Rice, Natural",Blue Buffalo,4.7898,157,5,Food &amp; Treats|Dry Food|,,cat,,,3.0,Lb,3 Lb
19.49,"BLUE Tastefuls Adult Dry Cat Food -  Hairball Control, Natural, Chicken &amp; Brown Rice",https://s7d2.scene7.com/is/image/PetSmart/5343387,https://www.petsmart.ca/cat/food-and-treats/dry-food/blue-tastefuls-adult-dry-cat-food----hairball-control-natural-chicken-and-brown-rice-5343387.html,"BLUE Tastefuls Adult Dry Cat Food -  Hairball Control, Natural, Chicken &amp; Brown Rice",Blue Buffalo,4.75,84,5,Food &amp; Treats|Dry Food|,,cat,,,3.0,Lb,3 Lb
31.99,Nulo Digestive Health Adult Cat Dry Food - Chicken &amp; Whitefish,https://s7d2.scene7.com/is/image/PetSmart/5338049,https://www.petsmart.ca/cat/food-and-treats/dry-food/nulo-digestive-health-adult-cat-dry-food---chicken-and-whitefish-5338049.html,Nulo Digestive Health Adult Cat Dry Food - Chicken &amp; Whitefish,Nulo,5.0,2,5,Food &amp; Treats|Dry Food|,,cat,,,4.5,Lb,4.5 Lb
69.99,Royal Canin Mother &amp; Babycat Dry Cat Food 3LB,https://s7d2.scene7.com/is/image/PetSmart/5339757,https://www.petsmart.ca/cat/food-and-treats/dry-food/royal-canin-mother-and-babycat-dry-cat-food-3lb-5339757.html,Royal Canin Mother &amp; Babycat Dry Cat Food 3LB,Royal Canin,4.8941,170,5,Food &amp; Treats|Dry Food|,,cat,,,6.0,Lb,6 Lb
113.99,Royal Canin Feline Care Nutrition/formulated/adult cats 14LB,https://s7d2.scene7.com/is/image/PetSmart/5337824,https://www.petsmart.ca/cat/food-and-treats/dry-food/royal-canin-feline-care-nutrition%2Fformulated%2Fadult-cats-14lb-5337824.html,Royal Canin Feline Care Nutrition/formulated/adult cats 14LB,Royal Canin,4.8974,78,5,Food &amp; Treats|Dry Food|,,cat,,,14.0,Lb,14 Lb
113.99,Royal Canin Kitten Dry Cat Food 3LB,https://s7d2.scene7.com/is/image/PetSmart/5339759,https://www.petsmart.ca/cat/food-and-treats/dry-food/royal-canin-kitten-dry-cat-food-3lb-5339759.html,Royal Canin Kitten Dry Cat Food 3LB,Royal Canin,4.8424,768,5,Food &amp; Treats|Dry Food|,,cat,,,14.0,Lb,14 Lb
38.99,Royal Canin Digestive Care Dry Cat Food 3LB,https://s7d2.scene7.com/is/image/PetSmart/5337898,https://www.petsmart.ca/cat/food-and-treats/dry-food/-royal-canin-digestive-care-dry-cat-food-3lb-5337898.html, Royal Canin Digestive Care Dry Cat Food 3LB,Royal Canin,3.9689,193,5,Food &amp; Treats|Dry Food|,,cat,,,3.0,Lb,3 Lb
41.99,Hill&#x27;s Science Diet Sensitive Stomach &amp; Skin Adult Dry Cat Food - Pollock,https://s7d2.scene7.com/is/image/PetSmart/5338147,https://www.petsmart.ca/cat/food-and-treats/dry-food/hills-science-diet-sensitive-stomach-and-skin-adult-dry-cat-food---pollock-5338147.html,Hill's Science Diet Sensitive Stomach &amp; Skin Adult Dry Cat Food - Pollock,Hill's Science Diet,3.6,10,5,Food &amp; Treats|Dry Food|,,cat,,,3.5,Lb,3.5 Lb
63.99,Hill&#x27;s Science Diet Kitten Ocean Fish 7LB,https://s7d2.scene7.com/is/image/PetSmart/5338146,https://www.petsmart.ca/cat/food-and-treats/dry-food/hills-science-diet-kitten-ocean-fish-7lb-5338146.html,Hill's Science Diet Kitten Ocean Fish 7LB,Hill's Science Diet,3.6667,3,5,Food &amp; Treats|Dry Food|,,cat,,,7.0,Lb,7 Lb
71.99,Hill&#x27;s Science Diet Sensitive Stomach &amp; Skin Adult Dry Cat Food - Pollock,https://s7d2.scene7.com/is/image/PetSmart/5338148,https://www.petsmart.ca/cat/food-and-treats/dry-food/hills-science-diet-sensitive-stomach-and-skin-adult-dry-cat-food---pollock-5338148.html,Hill's Science Diet Sensitive Stomach &amp; Skin Adult Dry Cat Food - Pollock,Hill's Science Diet,5.0,4,5,Food &amp; Treats|Dry Food|,,cat,,,6.0,Lb,6 Lb
38.99,Hill&#x27;s Science Diet Kitten Ocean Fish 3.5LB,https://s7d2.scene7.com/is/image/PetSmart/5338145,https://www.petsmart.ca/cat/food-and-treats/dry-food/hills-science-diet-kitten-ocean-fish-3.5lb-5338145.html,Hill's Science Diet Kitten Ocean Fish 3.5LB,Hill's Science Diet,4.8,5,5,Food &amp; Treats|Dry Food|,,cat,,,3.5,Lb,3.5 Lb
26.99,"Tiki Cat® Born Carnivore® for Indoor Cat Food # Chicken &amp; Turkey, Non-GMO",https://s7d2.scene7.com/is/image/PetSmart/5338479,https://www.petsmart.ca/cat/food-and-treats/dry-food/tiki-cat-born-carnivore-for-indoor-cat-food-%23-chicken-and-turkey-non-gmo-5338479.html,"Tiki Cat&reg; Born Carnivore&reg; for Indoor Cat Food # Chicken &amp; Turkey, Non-GMO",Tiki Cat,4.8571,7,5,Food &amp; Treats|Dry Food|,,cat,,,3.0,Lb,3 Lb
26.99,"Tiki Cat® Born Carnivore® for Indoor Cat Food # Trout &amp; Menhaden Fish, Non-GMO",https://s7d2.scene7.com/is/image/PetSmart/5338480,https://www.petsmart.ca/cat/food-and-treats/dry-food/tiki-cat-born-carnivore-for-indoor-cat-food-%23-trout-and-menhaden-fish-non-gmo-5338480.html,"Tiki Cat&reg; Born Carnivore&reg; for Indoor Cat Food # Trout &amp; Menhaden Fish, Non-GMO",Tiki Cat,5.0,3,5,Food &amp; Treats|Dry Food|,,cat,,,3.0,Lb,3 Lb
36.99,"Tiki Cat® Born Carnivore® for Adults 11+ Food # Chicken &amp; Herring, Non-GMO",https://s7d2.scene7.com/is/image/PetSmart/5338439,https://www.petsmart.ca/cat/food-and-treats/dry-food/tiki-cat-born-carnivore-for-adults-11%2B-food-%23-chicken-and-herring-non-gmo-5338439.html,"Tiki Cat&reg; Born Carnivore&reg; for Adults 11+ Food # Chicken &amp; Herring, Non-GMO",Tiki Cat,4.6667,3,5,Food &amp; Treats|Dry Food|,,cat,,,2.8,Lb,2.8 Lb
62.99,Tiki Cat Born Carnivore Silver - Senior - Chicken &amp; Herring - 5.6LB,https://s7d2.scene7.com/is/image/PetSmart/5338569,https://www.petsmart.ca/cat/food-and-treats/dry-food/tiki-cat-born-carnivore-silver---senior---chicken-and-herring---5.6lb-5338569.html,Tiki Cat Born Carnivore Silver - Senior - Chicken &amp; Herring - 5.6LB,Tiki Cat,5.0,2,5,Food &amp; Treats|Dry Food|,,cat,,,5.6,lb,5.6 lb
49.99,Nutrience Grain Free Adult Dry Cat Food - Ocean Fish,https://s7d2.scene7.com/is/image/PetSmart/5338730,https://www.petsmart.ca/cat/food-and-treats/dry-food/nutrience-grain-free-adult-dry-cat-food---ocean-fish-5338730.html,Nutrience Grain Free Adult Dry Cat Food - Ocean Fish,Nutrience,4.0,1,5,Food &amp; Treats|Dry Food|,,cat,,,5.0,kg,5 kg
45.99,Nutrience Infusion Healthy Senior Dry Cat Food - Chicken,https://s7d2.scene7.com/is/image/PetSmart/5338727,https://www.petsmart.ca/cat/food-and-treats/dry-food/nutrience-infusion-healthy-senior-dry-cat-food---chicken-5338727.html,Nutrience Infusion Healthy Senior Dry Cat Food - Chicken,Nutrience,4.3333,3,5,Food &amp; Treats|Dry Food|,,cat,,,5.0,kg,5 kg
29.99,Nutrience Infusion Indoor Adult Dry Cat Food - Ocean Fish,https://s7d2.scene7.com/is/image/PetSmart/5338728,https://www.petsmart.ca/cat/food-and-treats/dry-food/nutrience-infusion-indoor-adult-dry-cat-food---ocean-fish-5338728.html,Nutrience Infusion Indoor Adult Dry Cat Food - Ocean Fish,Nutrience,5.0,1,5,Food &amp; Treats|Dry Food|,,cat,,,2.27,kg,2.27 kg
45.99,Nutrience Infusion Healthy Adult Dry Cat Food - Chicken,https://s7d2.scene7.com/is/image/PetSmart/5338726,https://www.petsmart.ca/cat/food-and-treats/dry-food/nutrience-infusion-healthy-adult-dry-cat-food---chicken-5338726.html,Nutrience Infusion Healthy Adult Dry Cat Food - Chicken,Nutrience,,0,5,Food &amp; Treats|Dry Food|,,cat,,,5.0,kg,5 kg
26.99,IAMS Proactive Health Adult Dry Cat Food - Chicken &amp; Beef,https://s7d2.scene7.com/is/image/PetSmart/5338889,https://www.petsmart.ca/cat/food-and-treats/dry-food/iams-proactive-health-adult-dry-cat-food---chicken-and-beef-5338889.html,IAMS Proactive Health Adult Dry Cat Food - Chicken &amp; Beef,Iams,4.75,4,5,Food &amp; Treats|Dry Food|,,cat,,,2.27,kg,2.27 kg
26.99,IAMS Proactive Health Adult Dry Cat Food - Chicken &amp; Salmon,https://s7d2.scene7.com/is/image/PetSmart/5338887,https://www.petsmart.ca/cat/food-and-treats/dry-food/iams-proactive-health-adult-dry-cat-food---chicken-and-salmon-5338887.html,IAMS Proactive Health Adult Dry Cat Food - Chicken &amp; Salmon,Iams,4.2,5,5,Food &amp; Treats|Dry Food|,,cat,,,2.27,kg,2.27 kg
63.99,Natural Balance Original Ultra Indoor Adult Cat Dry Food - Chicken &amp; Salmon,https://s7d2.scene7.com/is/image/PetSmart/5339616,https://www.petsmart.ca/cat/food-and-treats/dry-food/natural-balance-original-ultra-indoor-adult-cat-dry-food---chicken-and-salmon-5339616.html,Natural Balance Original Ultra Indoor Adult Cat Dry Food - Chicken &amp; Salmon,Natural Balance,2.5,2,5,Food &amp; Treats|Dry Food|,,cat,,,15.0,Lb,15 Lb
