price,name,image,url,description,brand,rating,rating_count,rating_best,categories,health_consideration,animal_type,animal_lifestage,animal_size,size_value,size_unit,size_merged
67.99,"Blue Buffalo® Freedom&amp;trade;  All Life Stages Dry Cat Food - Grain Free, Chicken",https://s7d2.scene7.com/is/image/PetSmart/5200040,https://www.petsmart.ca/cat/food-and-treats/dry-food/blue-buffalo-freedomandtrade--all-life-stages-dry-cat-food---grain-free-chicken-5200040.html,"Blue Buffalo&reg; Freedom&amp;trade;  All Life Stages Dry Cat Food - Grain Free, Chicken",Blue Buffalo,4.8333,12,5,Food &amp; Treats|Dry Food|,,cat,,,11.0,Lb,11 Lb
29.99,Purina® Cat Chow® Advanced Nutrition Indoor Adult Cat Food,https://s7d2.scene7.com/is/image/PetSmart/5091207,https://www.petsmart.ca/cat/food-and-treats/dry-food/purina-cat-chow-advanced-nutrition-indoor-adult-cat-food-5091207.html,Purina&reg; Cat Chow&reg; Advanced Nutrition Indoor Adult Cat Food,Purina Cat Chow,4.8305,413,5,Food &amp; Treats|Dry Food|,,cat,,,8.0,kg,8 kg
17.29,Purina® Cat Chow® Advanced Nutrition Hairball Control Adult Cat Food,https://s7d2.scene7.com/is/image/PetSmart/5014589,https://www.petsmart.ca/cat/food-and-treats/dry-food/purina-cat-chow-advanced-nutrition-hairball-control-adult-cat-food-5014589.html,Purina&reg; Cat Chow&reg; Advanced Nutrition Hairball Control Adult Cat Food,Purina Cat Chow,4.7905,148,5,Food &amp; Treats|Dry Food|,,cat,,,3.2,kg,3.2 kg
109.99,Royal Canin® Feline Health Nutrition&#xfffd; Sensitive Digestion Adult Dry Cat Food,https://s7d2.scene7.com/is/image/PetSmart/5070438,https://www.petsmart.ca/cat/food-and-treats/dry-food/royal-canin-feline-health-nutrition%C2%99-sensitive-digestion-adult-dry-cat-food-5070438.html,Royal Canin&reg; Feline Health Nutrition Sensitive Digestion Adult Dry Cat Food,Royal Canin,4.6355,321,5,Food &amp; Treats|Dry Food|,,cat,,,15.0,Lb,15 Lb
44.99,"Purina Pro Plan Specialized Adult Dry Cat Food - Low Calorie, No Artificial Colors, Chicken &amp; Rice",https://s7d2.scene7.com/is/image/PetSmart/5139233,https://www.petsmart.ca/cat/food-and-treats/dry-food/purina-pro-plan-specialized-adult-dry-cat-food---low-calorie-no-artificial-colors-chicken-and-rice-5139233.html,"Purina Pro Plan Specialized Adult Dry Cat Food - Low Calorie, No Artificial Colors, Chicken &amp; Rice",Purina Pro Plan,4.5567,776,5,Food &amp; Treats|Dry Food|,,cat,,,7.0,Lb,7 Lb
35.99,"Nutrience® Grain Free Cat Food - Turkey, Chicken &amp; Herring",https://s7d2.scene7.com/is/image/PetSmart/5200408,https://www.petsmart.ca/cat/food-and-treats/dry-food/nutrience-grain-free-cat-food---turkey-chicken-and-herring-5200408.html,"Nutrience&reg; Grain Free Cat Food - Turkey, Chicken &amp; Herring",Nutrience,4.875,8,5,Food &amp; Treats|Dry Food|,,cat,,,5.5,Lb,5.5 Lb
71.99,Hill&#x27;s® Science Diet® Oral Care Adult Dry Cat Food - Chicken,https://s7d2.scene7.com/is/image/PetSmart/5017764,https://www.petsmart.ca/cat/food-and-treats/dry-food/hills-science-diet-oral-care-adult-dry-cat-food---chicken-5017764.html,Hill's&reg; Science Diet&reg; Oral Care Adult Dry Cat Food - Chicken,Hill's Science Diet,4.6797,306,5,Food &amp; Treats|Dry Food|,,cat,,,7.0,Lb,7 Lb
96.99,Hill&#x27;s® Science Diet® Sensitive Stomach &amp; Skin Adult Dry Cat Food - Chicken,https://s7d2.scene7.com/is/image/PetSmart/5012741,https://www.petsmart.ca/cat/food-and-treats/dry-food/hills-science-diet-sensitive-stomach-and-skin-adult-dry-cat-food---chicken-5012741.html,Hill's&reg; Science Diet&reg; Sensitive Stomach &amp; Skin Adult Dry Cat Food - Chicken,Hill's Science Diet,4.3573,487,5,Food &amp; Treats|Dry Food|,,cat,,,15.5,Lb,15.5 Lb
71.99,Hill&#x27;s® Science Diet® Hairball Control Adult Senior 7+ Dry Cat Food - Chicken,https://s7d2.scene7.com/is/image/PetSmart/5002975,https://www.petsmart.ca/cat/food-and-treats/dry-food/hills-science-diet-hairball-control-adult-senior-7%2B-dry-cat-food---chicken-5002975.html,Hill's&reg; Science Diet&reg; Hairball Control Adult Senior 7+ Dry Cat Food - Chicken,Hill's Science Diet,4.5127,158,5,Food &amp; Treats|Dry Food|,,cat,,,7.0,Lb,7 Lb
91.99,Hill&#x27;s® Science Diet® Light Adult Dry Cat Food - Chicken,https://s7d2.scene7.com/is/image/PetSmart/1021006,https://www.petsmart.ca/cat/food-and-treats/dry-food/hills-science-diet-light-adult-dry-cat-food---chicken-1021006.html,Hill's&reg; Science Diet&reg; Light Adult Dry Cat Food - Chicken,Hill's Science Diet,4.6131,274,5,Food &amp; Treats|Dry Food|,,cat,,,16.0,Lb,16 Lb
10.99,WHISKAS® Hairball Control Cat Food,https://s7d2.scene7.com/is/image/PetSmart/5103782,https://www.petsmart.ca/cat/food-and-treats/dry-food/whiskas-hairball-control-cat-food-5103782.html,WHISKAS&reg; Hairball Control Cat Food,Whiskas,4.25,56,5,Food &amp; Treats|Dry Food|,,cat,,,3.3,Lb,3.3 Lb
67.99,"Blue Buffalo® Freedom&amp;trade;  All Life Stages Dry Cat Food - Grain Free, Chicken",https://s7d2.scene7.com/is/image/PetSmart/5173164,https://www.petsmart.ca/cat/food-and-treats/dry-food/blue-buffalo-freedomandtrade--all-life-stages-dry-cat-food---grain-free-chicken-5173164.html,"Blue Buffalo&reg; Freedom&amp;trade;  All Life Stages Dry Cat Food - Grain Free, Chicken",Blue Buffalo,4.8073,109,5,Food &amp; Treats|Dry Food|,,cat,,,11.0,Lb,11 Lb
63.99,Hill&#x27;s® Science Diet® Senior 11+ Dry Cat Food - Chicken,https://s7d2.scene7.com/is/image/PetSmart/5166529,https://www.petsmart.ca/cat/food-and-treats/dry-food/hills-science-diet-senior-11%2B-dry-cat-food---chicken-5166529.html,Hill's&reg; Science Diet&reg; Senior 11+ Dry Cat Food - Chicken,Hill's Science Diet,4.5779,263,5,Food &amp; Treats|Dry Food|,,cat,,,7.0,Lb,7 Lb
35.99,Nutrience® Grain Free Adult Cat Food - Ocean Fish &amp; Salmon,https://s7d2.scene7.com/is/image/PetSmart/5200406,https://www.petsmart.ca/cat/food-and-treats/dry-food/nutrience-grain-free-adult-cat-food---ocean-fish-and-salmon-5200406.html,Nutrience&reg; Grain Free Adult Cat Food - Ocean Fish &amp; Salmon,Nutrience,5.0,7,5,Food &amp; Treats|Dry Food|,,cat,,,2.5,kg,2.5 kg
28.99,Nutrience® Original Healthy Adult Cat Food,https://s7d2.scene7.com/is/image/PetSmart/5200412,https://www.petsmart.ca/cat/food-and-treats/dry-food/nutrience-original-healthy-adult-cat-food-5200412.html,Nutrience&reg; Original Healthy Adult Cat Food,Nutrience,1.0,1,5,Food &amp; Treats|Dry Food|,,cat,,,5.5,Lb,5.5 Lb
28.99,Nutrience® Original Healthy Adult Indoor Cat Food,https://s7d2.scene7.com/is/image/PetSmart/5200410,https://www.petsmart.ca/cat/food-and-treats/dry-food/nutrience-original-healthy-adult-indoor-cat-food-5200410.html,Nutrience&reg; Original Healthy Adult Indoor Cat Food,Nutrience,4.6842,19,5,Food &amp; Treats|Dry Food|,,cat,,,5.5,Lb,5.5 Lb
32.99,"Blue Buffalo® Wilderness&amp;trade;  Adult Dry Cat Food - Grain Free, Chicken",https://s7d2.scene7.com/is/image/PetSmart/5173159,https://www.petsmart.ca/cat/food-and-treats/dry-food/blue-buffalo-wildernessandtrade--adult-dry-cat-food---grain-free-chicken-5173159.html,"Blue Buffalo&reg; Wilderness&amp;trade;  Adult Dry Cat Food - Grain Free, Chicken",Blue Buffalo,4.7466,363,5,Food &amp; Treats|Dry Food|,,cat,,,2.0,Lb,2 Lb
64.99,"Blue Buffalo® Basics&amp;trade;  Adult Dry Cat Food - Grain Free, Turkey",https://s7d2.scene7.com/is/image/PetSmart/5173162,https://www.petsmart.ca/cat/food-and-treats/dry-food/blue-buffalo-basicsandtrade--adult-dry-cat-food---grain-free-turkey-5173162.html,"Blue Buffalo&reg; Basics&amp;trade;  Adult Dry Cat Food - Grain Free, Turkey",Blue Buffalo,4.4783,23,5,Food &amp; Treats|Dry Food|,,cat,,,11.0,Lb,11 Lb
64.99,"Nutro Wholesome Essentials &amp;trade; Indoor Adult Dry Cat Food - Non-GMO, Natural, Chicken &amp; Brown Ric",https://s7d2.scene7.com/is/image/PetSmart/5197295,https://www.petsmart.ca/cat/food-and-treats/dry-food/nutro-wholesome-essentials-andtrade-indoor-adult-dry-cat-food---non-gmo-natural-chicken-and-brown-ric-5197295.html,"Nutro Wholesome Essentials &amp;trade; Indoor Adult Dry Cat Food - Non-GMO, Natural, Chicken &amp; Brown Ric",NUTRO,4.4977,217,5,Food &amp; Treats|Dry Food|,,cat,,,14.0,Lb,14 Lb
91.99,Hill&#x27;s® Science Diet® Indoor Adult Dry Cat Food - Chicken,https://s7d2.scene7.com/is/image/PetSmart/5102283,https://www.petsmart.ca/cat/food-and-treats/dry-food/hills-science-diet-indoor-adult-dry-cat-food---chicken-5102283.html,Hill's&reg; Science Diet&reg; Indoor Adult Dry Cat Food - Chicken,Hill's Science Diet,4.6779,475,5,Food &amp; Treats|Dry Food|,,cat,,,15.5,Lb,15.5 Lb
44.99,"Purina Pro Plan Specialized  Adult Dry Cat Food - No Artificial Colors or Flavors, Lamb &amp; Rice",https://s7d2.scene7.com/is/image/PetSmart/5139231,https://www.petsmart.ca/cat/food-and-treats/dry-food/purina-pro-plan-specialized--adult-dry-cat-food---no-artificial-colors-or-flavors-lamb-and-rice-5139231.html,"Purina Pro Plan Specialized  Adult Dry Cat Food - No Artificial Colors or Flavors, Lamb &amp; Rice",Purina Pro Plan,4.7268,388,5,Food &amp; Treats|Dry Food|,,cat,,,7.0,Lb,7 Lb
91.99,Hill&#x27;s® Science Diet® Indoor Adult Senior 7+ Dry Cat Food - Chicken,https://s7d2.scene7.com/is/image/PetSmart/5117968,https://www.petsmart.ca/cat/food-and-treats/dry-food/hills-science-diet-indoor-adult-senior-7%2B-dry-cat-food---chicken-5117968.html,Hill's&reg; Science Diet&reg; Indoor Adult Senior 7+ Dry Cat Food - Chicken,Hill's Science Diet,4.4507,213,5,Food &amp; Treats|Dry Food|,,cat,,,15.5,Lb,15.5 Lb
28.99,"Purina Pro Plan Focus Indoor Adult Dry Cat Food - With Vitamins, High Fiber, Turkey &amp; Rice",https://s7d2.scene7.com/is/image/PetSmart/5139225,https://www.petsmart.ca/cat/food-and-treats/dry-food/purina-pro-plan-focus-indoor-adult-dry-cat-food---with-vitamins-high-fiber-turkey-and-rice-5139225.html,"Purina Pro Plan Focus Indoor Adult Dry Cat Food - With Vitamins, High Fiber, Turkey &amp; Rice",Purina Pro Plan,4.4886,966,5,Food &amp; Treats|Dry Food|,,cat,,,3.5,Lb,3.5 Lb
91.99,Hill&#x27;s® Science Diet® Adult Senior 7+ Dry Cat Food - Chicken,https://s7d2.scene7.com/is/image/PetSmart/1021440,https://www.petsmart.ca/cat/food-and-treats/dry-food/hills-science-diet-adult-senior-7%2B-dry-cat-food---chicken-1021440.html,Hill's&reg; Science Diet&reg; Adult Senior 7+ Dry Cat Food - Chicken,Hill's Science Diet,4.629,124,5,Food &amp; Treats|Dry Food|,,cat,,,16.0,Lb,16 Lb
63.99,Hill&#x27;s® Science Diet® Indoor Senior 11+ Dry Cat Food - Chicken,https://s7d2.scene7.com/is/image/PetSmart/5202969,https://www.petsmart.ca/cat/food-and-treats/dry-food/hills-science-diet-indoor-senior-11%2B-dry-cat-food---chicken-5202969.html,Hill's&reg; Science Diet&reg; Indoor Senior 11+ Dry Cat Food - Chicken,Hill's Science Diet,4.6261,115,5,Food &amp; Treats|Dry Food|,,cat,,,7.0,Lb,7 Lb
93.99,"Blue Buffalo® Basics&amp;trade; Large Breed Adult Dry Dog Food - Natural, Turkey",https://s7d2.scene7.com/is/image/PetSmart/5168393,https://www.petsmart.ca/dog/food/dry-food/blue-buffalo-basicsandtrade-large-breed-adult-dry-dog-food---natural-turkey-5168393.html,"Blue Buffalo&reg; Basics&amp;trade; Large Breed Adult Dry Dog Food - Natural, Turkey",Blue Buffalo,4.65,40,5,Food|Dry Food|,,dog,,,24.0,Lb,24 Lb
76.99,"Hill&#x27;s® Science Diet® Adult Dry Dog Food - Small Bites, Lamb Meal &amp; Brown Rice",https://s7d2.scene7.com/is/image/PetSmart/5154828,https://www.petsmart.ca/dog/food/dry-food/hills-science-diet-adult-dry-dog-food---small-bites-lamb-meal-and-brown-rice-5154828.html,"Hill's&reg; Science Diet&reg; Adult Dry Dog Food - Small Bites, Lamb Meal &amp; Brown Rice",Hill's Science Diet,4.7083,192,5,Food|Dry Food|,,dog,,,15.5,Lb,15.5 Lb
78.99,Authority® Everyday Health Large Breed Adult Dry Dog Food - Lamb,https://s7d2.scene7.com/is/image/PetSmart/5278893,https://www.petsmart.ca/dog/food/dry-food/authority-everyday-health-large-breed-adult-dry-dog-food---lamb-5278893.html,Authority&reg; Everyday Health Large Breed Adult Dry Dog Food - Lamb,Authority,4.2778,90,5,Food|Dry Food|,,dog,,,34.0,Lb,34 Lb
78.99,Authority® Everyday Health Adult Dry Dog Food - Chicken,https://s7d2.scene7.com/is/image/PetSmart/5278901,https://www.petsmart.ca/dog/food/dry-food/authority-everyday-health-adult-dry-dog-food---chicken-5278901.html,Authority&reg; Everyday Health Adult Dry Dog Food - Chicken,Authority,4.25,28,5,Food|Dry Food|,,dog,,,30.0,Lb,30 Lb
123.99,Royal Canin® Size Health Nutrition&#xfffd; Giant Puppy Dry Dog Food,https://s7d2.scene7.com/is/image/PetSmart/5199388,https://www.petsmart.ca/dog/food/dry-food/royal-canin-size-health-nutrition%C2%99-giant-puppy-dry-dog-food-5199388.html,Royal Canin&reg; Size Health Nutrition Giant Puppy Dry Dog Food,Royal Canin,4.642,81,5,Food|Dry Food|,,dog,,,30.0,Lb,30 Lb
127.99,Royal Canin® Breed Health Nutrition® Labrador Retriever Puppy Breed Specific Dry Dog Food,https://s7d2.scene7.com/is/image/PetSmart/5150140,https://www.petsmart.ca/dog/food/dry-food/royal-canin-breed-health-nutrition-labrador-retriever-puppy-breed-specific-dry-dog-food-5150140.html,Royal Canin&reg; Breed Health Nutrition&reg; Labrador Retriever Puppy Breed Specific Dry Dog Food,Royal Canin,4.6864,118,5,Food|Dry Food|,,dog,,,30.0,Lb,30 Lb
37.99,Royal Canin® Breed Health Nutrition® Chihuahua Puppy Dry Dog Food,https://s7d2.scene7.com/is/image/PetSmart/5173225,https://www.petsmart.ca/dog/food/dry-food/royal-canin-breed-health-nutrition-chihuahua-puppy-dry-dog-food-5173225.html,Royal Canin&reg; Breed Health Nutrition&reg; Chihuahua Puppy Dry Dog Food,Royal Canin,4.9262,122,5,Food|Dry Food|,,dog,,,2.5,Lb,2.5 Lb
11.89,Purina ONE SmartBlend Puppy Food - Lamb &amp; Rice,https://s7d2.scene7.com/is/image/PetSmart/5264848,https://www.petsmart.ca/dog/food/dry-food/purina-one-smartblend-puppy-food---lamb-and-rice-5264848.html,Purina ONE SmartBlend Puppy Food - Lamb &amp; Rice,Purina ONE,4.8391,87,5,Food|Dry Food|,,dog,,,1.8,kg,1.8 kg
90.99,"HALO® DreamCoat Adult Dog Food - Natural, Holistic Chicken &amp; Chicken Liver Recipe",https://s7d2.scene7.com/is/image/PetSmart/5140685,https://www.petsmart.ca/dog/food/dry-food/halo-dreamcoat-adult-dog-food---natural-holistic-chicken-and-chicken-liver-recipe-5140685.html,"HALO&reg; DreamCoat Adult Dog Food - Natural, Holistic Chicken &amp; Chicken Liver Recipe",HALO,4.75,4,5,Food|Dry Food|,,dog,,,21.0,Lb,21 Lb
77.99,Canidae Pure Adult Dry Dog Food - Lamb &amp; Brown Rice,https://s7d2.scene7.com/is/image/PetSmart/5344621,https://www.petsmart.ca/dog/food/dry-food/canidae-pure-adult-dry-dog-food---lamb-and-brown-rice-5344621.html,Canidae Pure Adult Dry Dog Food - Lamb &amp; Brown Rice,CANIDAE,,0,5,Food|Dry Food|,,dog,,,22.0,lb,22 lb
97.99,"Wellness® CORE® Senior Dry Dog Food - Natural, Grain Free",https://s7d2.scene7.com/is/image/PetSmart/5279671,https://www.petsmart.ca/dog/food/dry-food/wellness-core-senior-dry-dog-food---natural-grain-free-5279671.html,"Wellness&reg; CORE&reg; Senior Dry Dog Food - Natural, Grain Free",Wellness,4.2093,43,5,Food|Dry Food|,,dog,,,24.0,Lb,24 Lb
46.99,Authority® Gut Health Adult Dry Dog Food - Chicken,https://s7d2.scene7.com/is/image/PetSmart/5309264,https://www.petsmart.ca/dog/food/dry-food/authority-gut-health-adult-dry-dog-food---chicken-5309264.html,Authority&reg; Gut Health Adult Dry Dog Food - Chicken,Authority,4.5,120,5,Food|Dry Food|,,dog,,,18.0,Lb,18 Lb
39.99,"Only Natural Pet® Wholesome Homemade All Life Stage Dry Dog Food - Poultry, High-Protein, Grain Fre",https://s7d2.scene7.com/is/image/PetSmart/5330449,https://www.petsmart.ca/dog/food/dry-food/only-natural-pet-wholesome-homemade-all-life-stage-dry-dog-food---poultry-high-protein-grain-fre-5330449.html,"Only Natural Pet&reg; Wholesome Homemade All Life Stage Dry Dog Food - Poultry, High-Protein, Grain Fre",Only Natural Pet,4.7,10,5,Food|Dry Food|,,dog,,,6.0,Lb,6 Lb
93.99,"Blue Buffalo® Basics&amp;trade; Adult Dry Dog Food - Natural, Salmon",https://s7d2.scene7.com/is/image/PetSmart/5150157,https://www.petsmart.ca/dog/food/dry-food/blue-buffalo-basicsandtrade-adult-dry-dog-food---natural-salmon-5150157.html,"Blue Buffalo&reg; Basics&amp;trade; Adult Dry Dog Food - Natural, Salmon",Blue Buffalo,4.7159,88,5,Food|Dry Food|,,dog,,,24.0,Lb,24 Lb
92.99,Nulo MedalSeries Senior Dry Dog Food - Chicken,https://s7d2.scene7.com/is/image/PetSmart/5212677,https://www.petsmart.ca/dog/food/dry-food/nulo-medalseries-senior-dry-dog-food---chicken-5212677.html,Nulo MedalSeries Senior Dry Dog Food - Chicken,Nulo,4.9714,35,5,Food|Dry Food|,,dog,,,24.0,Lb,24 Lb
92.99,Nulo MedalSeries Puppy Dry Dog Food - Chicken,https://s7d2.scene7.com/is/image/PetSmart/5212528,https://www.petsmart.ca/dog/food/dry-food/nulo-medalseries-puppy-dry-dog-food---chicken-5212528.html,Nulo MedalSeries Puppy Dry Dog Food - Chicken,Nulo,4.4706,51,5,Food|Dry Food|,,dog,,,24.0,Lb,24 Lb
66.99,"Blue Buffalo® Life Protection Formula&amp;trade;  Adult Dry Dog Food - Natural, Beef",https://s7d2.scene7.com/is/image/PetSmart/5322061,https://www.petsmart.ca/dog/food/dry-food/blue-buffalo-life-protection-formulaandtrade--adult-dry-dog-food---natural-beef-5322061.html,"Blue Buffalo&reg; Life Protection Formula&amp;trade;  Adult Dry Dog Food - Natural, Beef",Blue Buffalo,4.7059,17,5,Food|Dry Food|,,dog,,,26.0,Lb,26 Lb
26.99,"Blue Buffalo® Life Protection Formula&amp;trade; Small Breed Adult Dry Dog Food - Natural, Beef",https://s7d2.scene7.com/is/image/PetSmart/5322198,https://www.petsmart.ca/dog/food/dry-food/blue-buffalo-life-protection-formulaandtrade-small-breed-adult-dry-dog-food---natural-beef-5322198.html,"Blue Buffalo&reg; Life Protection Formula&amp;trade; Small Breed Adult Dry Dog Food - Natural, Beef",Blue Buffalo,4.8262,1139,5,Food|Dry Food|,,dog,,,6.0,Lb,6 Lb
27.99,"Nulo MedalSeries Small Breed Adult Dry Dog Food - High-Protein, Chicken, duck &amp; Turkey",https://s7d2.scene7.com/is/image/PetSmart/5322763,https://www.petsmart.ca/dog/food/dry-food/nulo-medalseries-small-breed-adult-dry-dog-food---high-protein-chicken-duck-and-turkey-5322763.html,"Nulo MedalSeries Small Breed Adult Dry Dog Food - High-Protein, Chicken, duck &amp; Turkey",Nulo,4.7838,37,5,Food|Dry Food|,,dog,,,4.0,Lb,4 Lb
27.99,Nulo MedalSeries Puppy Dry Dog Food - Turkey,https://s7d2.scene7.com/is/image/PetSmart/5300300,https://www.petsmart.ca/dog/food/dry-food/nulo-medalseries-puppy-dry-dog-food---turkey-5300300.html,Nulo MedalSeries Puppy Dry Dog Food - Turkey,Nulo,4.7455,55,5,Food|Dry Food|,,dog,,,4.5,Lb,4.5 Lb
34.99,Zeal Air-Dried Dog Food - Beef,https://s7d2.scene7.com/is/image/PetSmart/5345436,https://www.petsmart.ca/dog/food/dry-food/zeal-air-dried-dog-food---beef-5345436.html,Zeal Air-Dried Dog Food - Beef,Zeal Canada,,0,5,Food|Dry Food|,,dog,,,1.0,Lb,1 Lb
31.99,"HALO® Holistic Adult Dry Dog Food - Natural, Wild-caught Salmon &amp; Whitefish",https://s7d2.scene7.com/is/image/PetSmart/5340257,https://www.petsmart.ca/dog/food/dry-food/halo-holistic-adult-dry-dog-food---natural-wild-caught-salmon-and-whitefish-5340257.html,"HALO&reg; Holistic Adult Dry Dog Food - Natural, Wild-caught Salmon &amp; Whitefish",HALO,,0,5,Food|Dry Food|,,dog,,,3.5,Lb,3.5 Lb
34.99,Purina Puppy Chow with Real Chicken Dry Dog Food,https://s7d2.scene7.com/is/image/PetSmart/5340717,https://www.petsmart.ca/dog/food/dry-food/purina-puppy-chow-with-real-chicken-dry-dog-food-5340717.html,Purina Puppy Chow with Real Chicken Dry Dog Food,Purina Puppy Chow,4.6024,3219,5,Food|Dry Food|,,dog,,,11.4,kg,11.4 kg
34.99,Purina Dog Chow Complete Adult with Real Chicken Dry Dog Food,https://s7d2.scene7.com/is/image/PetSmart/5340715,https://www.petsmart.ca/dog/food/dry-food/purina-dog-chow-complete-adult-with-real-chicken-dry-dog-food-5340715.html,Purina Dog Chow Complete Adult with Real Chicken Dry Dog Food,Purina Dog Chow,4.7302,189,5,Food|Dry Food|,,dog,,,14.0,kg,14 kg
35.99,Royal Canin Breed Health Nutrition Poodle Adult Dry Dog Food - Chicken,https://s7d2.scene7.com/is/image/PetSmart/5345496,https://www.petsmart.ca/dog/food/dry-food/royal-canin-breed-health-nutrition-poodle-adult-dry-dog-food---chicken-5345496.html,Royal Canin Breed Health Nutrition Poodle Adult Dry Dog Food - Chicken,Royal Canin,4.8387,124,5,Food|Dry Food|,,dog,,,2.5,Lb,2.5 Lb
39.99,"Royal Canin Cocker Spaniel Medium Breed Adult Dry Dog Food - Skin &amp; Coat Health, Chicken",https://s7d2.scene7.com/is/image/PetSmart/5343858,https://www.petsmart.ca/dog/food/dry-food/royal-canin-cocker-spaniel-medium-breed-adult-dry-dog-food---skin-and-coat-health-chicken-5343858.html,"Royal Canin Cocker Spaniel Medium Breed Adult Dry Dog Food - Skin &amp; Coat Health, Chicken",Royal Canin,4.74,50,5,Food|Dry Food|,,dog,,,6.0,Lb,6 Lb
31.99,"Blue Buffalo® Wilderness&amp;trade; Adult Dry Dog Food - Natural, High Protein, Wholesome Grains, Duck",https://s7d2.scene7.com/is/image/PetSmart/5339213,https://www.petsmart.ca/dog/food/dry-food/blue-buffalo-wildernessandtrade-adult-dry-dog-food---natural-high-protein-wholesome-grains-duck-5339213.html,"Blue Buffalo&reg; Wilderness&amp;trade; Adult Dry Dog Food - Natural, High Protein, Wholesome Grains, Duck",Blue Buffalo,4.5462,249,5,Food|Dry Food|,,dog,,,4.5,Lb,4.5 Lb
94.99,Royal Canin® Digestive Care Medium Breed Dry Dog Food,https://s7d2.scene7.com/is/image/PetSmart/5336256,https://www.petsmart.ca/dog/food/dry-food/royal-canin-digestive-care-medium-breed-dry-dog-food-5336256.html,Royal Canin&reg; Digestive Care Medium Breed Dry Dog Food,Royal Canin,4.5143,35,5,Food|Dry Food|,,dog,,,17.0,Lb,17 Lb
31.99,Halo Holistic Vegan Plant-Based with Kelp Dry Dog Food,https://s7d2.scene7.com/is/image/PetSmart/5340256,https://www.petsmart.ca/dog/food/dry-food/halo-holistic-vegan-plant-based-with-kelp-dry-dog-food-5340256.html,Halo Holistic Vegan Plant-Based with Kelp Dry Dog Food,HALO,5.0,1,5,Food|Dry Food|,,dog,,,3.5,Lb,3.5 Lb
31.99,"Blue Buffalo® Wilderness&amp;trade; Adult Dry Dog Food - Natural, High Protein, Wholesome Grains, Chicke",https://s7d2.scene7.com/is/image/PetSmart/5339251,https://www.petsmart.ca/dog/food/dry-food/blue-buffalo-wildernessandtrade-adult-dry-dog-food---natural-high-protein-wholesome-grains-chicke-5339251.html,"Blue Buffalo&reg; Wilderness&amp;trade; Adult Dry Dog Food - Natural, High Protein, Wholesome Grains, Chicke",Blue Buffalo,4.5843,267,5,Food|Dry Food|,,dog,,,4.5,Lb,4.5 Lb
130.99,"Royal Canin Large Breed Joint Care Adult Dry Dog Food - Skin &amp; Coat Health, Chicken",https://s7d2.scene7.com/is/image/PetSmart/5343856,https://www.petsmart.ca/dog/food/dry-food/royal-canin-large-breed-joint-care-adult-dry-dog-food---skin-and-coat-health-chicken-5343856.html,"Royal Canin Large Breed Joint Care Adult Dry Dog Food - Skin &amp; Coat Health, Chicken",Royal Canin,4.814,43,5,Food|Dry Food|,,dog,,,30.0,Lb,30 Lb
34.99,"Merrick® Backcountry® Adult Dry Dog Food - Beef, Grain Free, Gluten Free",https://s7d2.scene7.com/is/image/PetSmart/5299388,https://www.petsmart.ca/dog/food/dry-food/merrick-backcountry-adult-dry-dog-food---beef-grain-free-gluten-free-5299388.html,"Merrick&reg; Backcountry&reg; Adult Dry Dog Food - Beef, Grain Free, Gluten Free",Merrick,4.218,133,5,Food|Dry Food|,,dog,,,4.0,Lb,4 Lb
53.99,Simply Nourish® Original Small Breed Adult Dry Dog Food - Chicken &amp; Brown Rice,https://s7d2.scene7.com/is/image/PetSmart/5287518,https://www.petsmart.ca/dog/food/dry-food/simply-nourish-original-small-breed-adult-dry-dog-food---chicken-and-brown-rice-5287518.html,Simply Nourish&reg; Original Small Breed Adult Dry Dog Food - Chicken &amp; Brown Rice,Simply Nourish,4.589,163,5,Food|Dry Food|,,dog,,,15.0,Lb,15 Lb
30.99,Iams® ProActive Health Lamb &amp; Rice Adult Dog Food,https://s7d2.scene7.com/is/image/PetSmart/5282201,https://www.petsmart.ca/dog/food/dry-food/iams-proactive-health-lamb-and-rice-adult-dog-food-5282201.html,Iams&reg; ProActive Health Lamb &amp; Rice Adult Dog Food,Iams,5.0,3,5,Food|Dry Food|,,dog,,,15.0,Lb,15 Lb
27.99,"Nulo MedalSeries Adult Dry Dog Food - High-Protein, Beef",https://s7d2.scene7.com/is/image/PetSmart/5322843,https://www.petsmart.ca/dog/food/dry-food/nulo-medalseries-adult-dry-dog-food---high-protein-beef-5322843.html,"Nulo MedalSeries Adult Dry Dog Food - High-Protein, Beef",Nulo,4.625,40,5,Food|Dry Food|,,dog,,,4.0,Lb,4 Lb
129.99,"Instinct® Raw Boost Large Breed Puppy Dry Dog Food - Grain Free, Chicken Meal",https://s7d2.scene7.com/is/image/PetSmart/5216531,https://www.petsmart.ca/dog/food/dry-food/instinct-raw-boost-large-breed-puppy-dry-dog-food---grain-free-chicken-meal-5216531.html,"Instinct&reg; Raw Boost Large Breed Puppy Dry Dog Food - Grain Free, Chicken Meal",Instinct,4.4194,31,5,Food|Dry Food|,,dog,,,20.0,Lb,20 Lb
38.99,Hill&#x27;s Science Diet Perfect Weight Small Bites Adult Dry Dog Food - Chicken,https://s7d2.scene7.com/is/image/PetSmart/5313982,https://www.petsmart.ca/dog/food/dry-food/hills-science-diet-perfect-weight-small-bites-adult-dry-dog-food---chicken-5313982.html,Hill's Science Diet Perfect Weight Small Bites Adult Dry Dog Food - Chicken,Hill's Science Diet,4.6377,138,5,Food|Dry Food|,,dog,,,4.0,Lb,4 Lb
94.99,"Canidae® Pure&amp;trade; Adult Dry Dog Food - Limited Ingredient Diet, Salmon",https://s7d2.scene7.com/is/image/PetSmart/5288786,https://www.petsmart.ca/dog/food/dry-food/canidae-pureandtrade-adult-dry-dog-food---limited-ingredient-diet-salmon-5288786.html,"Canidae&reg; Pure&amp;trade; Adult Dry Dog Food - Limited Ingredient Diet, Salmon",CANIDAE,4.1045,67,5,Food|Dry Food|,,dog,,,24.0,Lb,24 Lb
22.99,"Canidae® Pure&amp;trade; Adult Dry Dog Food - Limited Ingredient Diet, With-Grain, Bison &amp; Barley",https://s7d2.scene7.com/is/image/PetSmart/5322332,https://www.petsmart.ca/dog/food/dry-food/canidae-pureandtrade-adult-dry-dog-food---limited-ingredient-diet-with-grain-bison-and-barley-5322332.html,"Canidae&reg; Pure&amp;trade; Adult Dry Dog Food - Limited Ingredient Diet, With-Grain, Bison &amp; Barley",CANIDAE,4.25,8,5,Food|Dry Food|,,dog,,,4.0,Lb,4 Lb
