price,name,image,url,description,brand,rating,rating_count,rating_best,categories,health_consideration,animal_type,animal_lifestage,animal_size,size_value,size_unit,size_merged
29.74,"Purina ONE True Instinct Adult Dry Dog Food - High Protein, Real Beef &amp; Bison",https://s7d2.scene7.com/is/image/PetSmart/5326577,https://www.petsmart.ca/dog/food/dry-food/purina-one-true-instinct-adult-dry-dog-food---high-protein-real-beef-and-bison-5326577.html,"Purina ONE True Instinct Adult Dry Dog Food - High Protein, Real Beef &amp; Bison",Purina ONE,4.4444,18,5,Food|Dry Food|,,dog,,,6.8,kg,6.8 kg
92.99,"Wellness® Complete Health Puppy Dry Dog Food - Natural, Grain Free, Chicken, Chicken &amp; Salmon Meal",https://s7d2.scene7.com/is/image/PetSmart/5264995,https://www.petsmart.ca/dog/food/dry-food/wellness-complete-health-puppy-dry-dog-food---natural-grain-free-chicken-chicken-and-salmon-meal-5264995.html,"Wellness&reg; Complete Health Puppy Dry Dog Food - Natural, Grain Free, Chicken, Chicken &amp; Salmon Meal",Wellness,4.8824,17,5,Food|Dry Food|,,dog,,,24.0,Lb,24 Lb
93.99,"Blue Buffalo® Basics&amp;trade; Adult Dry Dog Food - Natural, Turkey",https://s7d2.scene7.com/is/image/PetSmart/5150155,https://www.petsmart.ca/dog/food/dry-food/blue-buffalo-basicsandtrade-adult-dry-dog-food---natural-turkey-5150155.html,"Blue Buffalo&reg; Basics&amp;trade; Adult Dry Dog Food - Natural, Turkey",Blue Buffalo,4.8889,90,5,Food|Dry Food|,,dog,,,24.0,Lb,24 Lb
59.99,"HALO® DreamCoat Small Breed Adult Dry Dog Food - Natural, Holistic Chicken",https://s7d2.scene7.com/is/image/PetSmart/5173559,https://www.petsmart.ca/dog/food/dry-food/halo-dreamcoat-small-breed-adult-dry-dog-food---natural-holistic-chicken-5173559.html,"HALO&reg; DreamCoat Small Breed Adult Dry Dog Food - Natural, Holistic Chicken",HALO,5.0,7,5,Food|Dry Food|,,dog,,,10.0,Lb,10 Lb
11.89,Purina ONE SmartBlend Small Dog Food - Beef,https://s7d2.scene7.com/is/image/PetSmart/5264847,https://www.petsmart.ca/dog/food/dry-food/purina-one-smartblend-small-dog-food---beef-5264847.html,Purina ONE SmartBlend Small Dog Food - Beef,Purina ONE,4.7156,109,5,Food|Dry Food|,,dog,,,1.8,kg,1.8 kg
85.99,Royal Canin® Breed Health Nutrition® Boxer Adult Dry Dog Food,https://s7d2.scene7.com/is/image/PetSmart/5211759,https://www.petsmart.ca/dog/food/dry-food/royal-canin-breed-health-nutrition-boxer-adult-dry-dog-food-5211759.html,Royal Canin&reg; Breed Health Nutrition&reg; Boxer Adult Dry Dog Food,Royal Canin,4.8844,173,5,Food|Dry Food|,,dog,,,17.0,Lb,17 Lb
21.99,Nutrience® Infusion Small Breed Adult Dog Food - Chicken,https://s7d2.scene7.com/is/image/PetSmart/5257536,https://www.petsmart.ca/dog/food/dry-food/nutrience-infusion-small-breed-adult-dog-food---chicken-5257536.html,Nutrience&reg; Infusion Small Breed Adult Dog Food - Chicken,Nutrience,4.9091,11,5,Food|Dry Food|,,dog,,,2.27,kg,2.27 kg
79.99,"Wellness® Complete Health Adult Dog Food - Natural, Grain Free, Whitefish &amp; Menhaden Fish Meal",https://s7d2.scene7.com/is/image/PetSmart/5249002,https://www.petsmart.ca/dog/food/dry-food/wellness-complete-health-adult-dog-food---natural-grain-free-whitefish-and-menhaden-fish-meal-5249002.html,"Wellness&reg; Complete Health Adult Dog Food - Natural, Grain Free, Whitefish &amp; Menhaden Fish Meal",Wellness,5.0,2,5,Food|Dry Food|,,dog,,,24.0,Lb,24 Lb
123.99,Royal Canin® Size Health Nutrition&#xfffd; Medium Puppy Dry Dog Food,https://s7d2.scene7.com/is/image/PetSmart/5199226,https://www.petsmart.ca/dog/food/dry-food/royal-canin-size-health-nutrition%C2%99-medium-puppy-dry-dog-food-5199226.html,Royal Canin&reg; Size Health Nutrition Medium Puppy Dry Dog Food,Royal Canin,4.6772,189,5,Food|Dry Food|,,dog,,,30.0,Lb,30 Lb
48.44,Purina ONE SmartBlend Advanced Nutrition Dog Food,https://s7d2.scene7.com/is/image/PetSmart/5176092,https://www.petsmart.ca/dog/food/dry-food/purina-one-smartblend-advanced-nutrition-dog-food-5176092.html,Purina ONE SmartBlend Advanced Nutrition Dog Food,Purina ONE,4.7522,1376,5,Food|Dry Food|,,dog,,,30.9,Lb,30.9 Lb
37.99,Royal Canin® Breed Health Nutrition® Dachshund Puppy Breed Specific Dry Dog Food,https://s7d2.scene7.com/is/image/PetSmart/5211539,https://www.petsmart.ca/dog/food/dry-food/royal-canin-breed-health-nutrition-dachshund-puppy-breed-specific-dry-dog-food-5211539.html,Royal Canin&reg; Breed Health Nutrition&reg; Dachshund Puppy Breed Specific Dry Dog Food,Royal Canin,4.6515,66,5,Food|Dry Food|,,dog,,,2.5,Lb,2.5 Lb
127.99,Royal Canin® Breed Health Nutrition® Boxer Puppy Dry Dog Food,https://s7d2.scene7.com/is/image/PetSmart/5211605,https://www.petsmart.ca/dog/food/dry-food/royal-canin-breed-health-nutrition-boxer-puppy-dry-dog-food-5211605.html,Royal Canin&reg; Breed Health Nutrition&reg; Boxer Puppy Dry Dog Food,Royal Canin,4.8276,58,5,Food|Dry Food|,,dog,,,30.0,Lb,30 Lb
90.99,"HALO® Vegan Adult Dog Food - Natural, Holistic Garden of Vegan Recipe",https://s7d2.scene7.com/is/image/PetSmart/5181947,https://www.petsmart.ca/dog/food/dry-food/halo-vegan-adult-dog-food---natural-holistic-garden-of-vegan-recipe-5181947.html,"HALO&reg; Vegan Adult Dog Food - Natural, Holistic Garden of Vegan Recipe",HALO,4.4211,38,5,Food|Dry Food|,,dog,,,21.0,Lb,21 Lb
37.99,Royal Canin® Breed Health Nutrition® Yorkshire Terrier Puppy Breed Specific Dry Dog Food,https://s7d2.scene7.com/is/image/PetSmart/5150144,https://www.petsmart.ca/dog/food/dry-food/royal-canin-breed-health-nutrition-yorkshire-terrier-puppy-breed-specific-dry-dog-food-5150144.html,Royal Canin&reg; Breed Health Nutrition&reg; Yorkshire Terrier Puppy Breed Specific Dry Dog Food,Royal Canin,4.8352,182,5,Food|Dry Food|,,dog,,,2.5,Lb,2.5 Lb
85.99,Royal Canin® Breed Health Nutrition® French Bulldog Adult Breed Specific Dry Dog Food,https://s7d2.scene7.com/is/image/PetSmart/5211757,https://www.petsmart.ca/dog/food/dry-food/royal-canin-breed-health-nutrition-french-bulldog-adult-breed-specific-dry-dog-food-5211757.html,Royal Canin&reg; Breed Health Nutrition&reg; French Bulldog Adult Breed Specific Dry Dog Food,Royal Canin,4.7654,243,5,Food|Dry Food|,,dog,,,17.0,Lb,17 Lb
82.99,"Nutrience® Grain Free Dog Food - Pork, Lamb &amp; Venison",https://s7d2.scene7.com/is/image/PetSmart/5229709,https://www.petsmart.ca/dog/food/dry-food/nutrience-grain-free-dog-food---pork-lamb-and-venison-5229709.html,"Nutrience&reg; Grain Free Dog Food - Pork, Lamb &amp; Venison",Nutrience,3.8889,9,5,Food|Dry Food|,,dog,,,10.0,kg,10 kg
92.99,Wellness® Complete Health Adult Dog Food - Natural,https://s7d2.scene7.com/is/image/PetSmart/5153468,https://www.petsmart.ca/dog/food/dry-food/wellness-complete-health-adult-dog-food---natural-5153468.html,Wellness&reg; Complete Health Adult Dog Food - Natural,Wellness,4.5921,152,5,Food|Dry Food|,,dog,,,30.0,Lb,30 Lb
66.99,"Blue Buffalo® Life Protection Formula&amp;trade; Large Breed Adult Dry Dog Food - Natural, Chicken",https://s7d2.scene7.com/is/image/PetSmart/5288679,https://www.petsmart.ca/dog/food/dry-food/blue-buffalo-life-protection-formulaandtrade-large-breed-adult-dry-dog-food---natural-chicken-5288679.html,"Blue Buffalo&reg; Life Protection Formula&amp;trade; Large Breed Adult Dry Dog Food - Natural, Chicken",Blue Buffalo,4.7231,130,5,Food|Dry Food|,,dog,,,26.0,Lb,26 Lb
65.99,Simply Nourish® Original Large Breed Senior Dry Dog Food - Chicken &amp; Brown Rice,https://s7d2.scene7.com/is/image/PetSmart/5287557,https://www.petsmart.ca/dog/food/dry-food/simply-nourish-original-large-breed-senior-dry-dog-food---chicken-and-brown-rice-5287557.html,Simply Nourish&reg; Original Large Breed Senior Dry Dog Food - Chicken &amp; Brown Rice,Simply Nourish,4.1765,17,5,Food|Dry Food|,,dog,,,30.0,Lb,30 Lb
66.99,Simply Nourish® Limited Ingredient Diet Large Breed Adult Dry Dog Food - Salmon &amp; Sweet Potato,https://s7d2.scene7.com/is/image/PetSmart/5286975,https://www.petsmart.ca/dog/food/dry-food/simply-nourish-limited-ingredient-diet-large-breed-adult-dry-dog-food---salmon-and-sweet-potato-5286975.html,Simply Nourish&reg; Limited Ingredient Diet Large Breed Adult Dry Dog Food - Salmon &amp; Sweet Potato,Simply Nourish,4.6303,165,5,Food|Dry Food|,,dog,,,22.0,Lb,22 Lb
66.99,"Blue Buffalo® Life Protection Formula&amp;trade;  Adult Dry Dog Food - Natural, Lamb",https://s7d2.scene7.com/is/image/PetSmart/5291371,https://www.petsmart.ca/dog/food/dry-food/blue-buffalo-life-protection-formulaandtrade--adult-dry-dog-food---natural-lamb-5291371.html,"Blue Buffalo&reg; Life Protection Formula&amp;trade;  Adult Dry Dog Food - Natural, Lamb",Blue Buffalo,4.6273,483,5,Food|Dry Food|,,dog,,,26.0,Lb,26 Lb
31.99,"Nutrience® SubZero Small Breed Dog Food - Grain Free, Fraser Valley",https://s7d2.scene7.com/is/image/PetSmart/5280511,https://www.petsmart.ca/dog/food/dry-food/nutrience-subzero-small-breed-dog-food---grain-free-fraser-valley-5280511.html,"Nutrience&reg; SubZero Small Breed Dog Food - Grain Free, Fraser Valley",Nutrience,4.7143,28,5,Food|Dry Food|,,dog,,,2.27,kg,2.27 kg
78.99,"Authority® Everyday Health High Performance All Life Stage Dry Dog Food - Turkey, Salmon &amp; Duck",https://s7d2.scene7.com/is/image/PetSmart/5278691,https://www.petsmart.ca/dog/food/dry-food/authority-everyday-health-high-performance-all-life-stage-dry-dog-food---turkey-salmon-and-duck-5278691.html,"Authority&reg; Everyday Health High Performance All Life Stage Dry Dog Food - Turkey, Salmon &amp; Duck",Authority,4.6594,229,5,Food|Dry Food|,,dog,,,30.0,Lb,30 Lb
64.99,Simply Nourish® Original Adult Dry Dog Food - Chicken &amp; Brown Rice,https://s7d2.scene7.com/is/image/PetSmart/5287292,https://www.petsmart.ca/dog/food/dry-food/simply-nourish-original-adult-dry-dog-food---chicken-and-brown-rice-5287292.html,Simply Nourish&reg; Original Adult Dry Dog Food - Chicken &amp; Brown Rice,Simply Nourish,4.3433,268,5,Food|Dry Food|,,dog,,,30.0,Lb,30 Lb
32.99,"Nutrience® SubZero Small Breed Dog Food - Grain Free, Prairie Red",https://s7d2.scene7.com/is/image/PetSmart/5280512,https://www.petsmart.ca/dog/food/dry-food/nutrience-subzero-small-breed-dog-food---grain-free-prairie-red-5280512.html,"Nutrience&reg; SubZero Small Breed Dog Food - Grain Free, Prairie Red",Nutrience,4.7027,37,5,Food|Dry Food|,,dog,,,2.27,kg,2.27 kg
66.99,"Blue Buffalo® Life Protection Formula&amp;trade; Large Breed Adult Dry Dog Food - Natural, Chicken",https://s7d2.scene7.com/is/image/PetSmart/5288686,https://www.petsmart.ca/dog/food/dry-food/blue-buffalo-life-protection-formulaandtrade-large-breed-adult-dry-dog-food---natural-chicken-5288686.html,"Blue Buffalo&reg; Life Protection Formula&amp;trade; Large Breed Adult Dry Dog Food - Natural, Chicken",Blue Buffalo,5.0,3,5,Food|Dry Food|,,dog,,,26.0,Lb,26 Lb
123.99,Royal Canin® Size Health Nutrition&#xfffd; Large Aging 8+ Senior Dry Dog Food,https://s7d2.scene7.com/is/image/PetSmart/5199272,https://www.petsmart.ca/dog/food/dry-food/royal-canin-size-health-nutrition%C2%99-large-aging-8%2B-senior-dry-dog-food-5199272.html,Royal Canin&reg; Size Health Nutrition Large Aging 8+ Senior Dry Dog Food,Royal Canin,4.8214,56,5,Food|Dry Food|,,dog,,,30.0,Lb,30 Lb
31.99,Natural Balance Limited Ingredient Small Breed Adult Dry Dog Food - Salmon &amp; Sweet Potato,https://s7d2.scene7.com/is/image/PetSmart/5299937,https://www.petsmart.ca/dog/food/dry-food/natural-balance-limited-ingredient-small-breed-adult-dry-dog-food---salmon-and-sweet-potato-5299937.html,Natural Balance Limited Ingredient Small Breed Adult Dry Dog Food - Salmon &amp; Sweet Potato,Natural Balance,4.2545,55,5,Food|Dry Food|,,dog,,,4.0,Lb,4 Lb
37.99,"Blue Buffalo® True Solutions&amp;trade;  Adult Dry Dog Food - Natural, Chicken",https://s7d2.scene7.com/is/image/PetSmart/5298264,https://www.petsmart.ca/dog/food/dry-food/blue-buffalo-true-solutionsandtrade--adult-dry-dog-food---natural-chicken-5298264.html,"Blue Buffalo&reg; True Solutions&amp;trade;  Adult Dry Dog Food - Natural, Chicken",Blue Buffalo,4.8627,51,5,Food|Dry Food|,,dog,,,5.0,Lb,5 Lb
47.99,Nutro Natural Choice Adult Dog Food - Chicken &amp; Brown Rice,https://s7d2.scene7.com/is/image/PetSmart/5308662,https://www.petsmart.ca/dog/food/dry-food/nutro-natural-choice-adult-dog-food---chicken-and-brown-rice-5308662.html,Nutro Natural Choice Adult Dog Food - Chicken &amp; Brown Rice,NUTRO,5.0,5,5,Food|Dry Food|,,dog,,,12.0,Lb,12 Lb
37.99,"Blue Buffalo® True Solutions&amp;trade; Adult Dry Dog Food - Natural, Salmon",https://s7d2.scene7.com/is/image/PetSmart/5298297,https://www.petsmart.ca/dog/food/dry-food/blue-buffalo-true-solutionsandtrade-adult-dry-dog-food---natural-salmon-5298297.html,"Blue Buffalo&reg; True Solutions&amp;trade; Adult Dry Dog Food - Natural, Salmon",Blue Buffalo,4.6923,39,5,Food|Dry Food|,,dog,,,5.0,Lb,5 Lb
31.99,Natural Balance Limited Ingredient Diets Small Breed Adult Dry Dog Food - Duck &amp; Potato,https://s7d2.scene7.com/is/image/PetSmart/5299940,https://www.petsmart.ca/dog/food/dry-food/natural-balance-limited-ingredient-diets-small-breed-adult-dry-dog-food---duck-and-potato-5299940.html,Natural Balance Limited Ingredient Diets Small Breed Adult Dry Dog Food - Duck &amp; Potato,Natural Balance,4.4242,33,5,Food|Dry Food|,,dog,,,4.0,Lb,4 Lb
56.99,Nulo MedalSeries Small Breed All Life Stages Dry Dog Food - Chicken,https://s7d2.scene7.com/is/image/PetSmart/5322841,https://www.petsmart.ca/dog/food/dry-food/nulo-medalseries-small-breed-all-life-stages-dry-dog-food---chicken-5322841.html,Nulo MedalSeries Small Breed All Life Stages Dry Dog Food - Chicken,Nulo,4.4286,7,5,Food|Dry Food|,,dog,,,11.0,Lb,11 Lb
54.99,IAMS&amp;trade; Proactive Health Adult Dry Dog Food - Lamb &amp; Rice,https://s7d2.scene7.com/is/image/PetSmart/5326527,https://www.petsmart.ca/dog/food/dry-food/iamsandtrade-proactive-health-adult-dry-dog-food---lamb-and-rice-5326527.html,IAMS&amp;trade; Proactive Health Adult Dry Dog Food - Lamb &amp; Rice,Iams,4.6,85,5,Food|Dry Food|,,dog,,,,,One Size
16.99,Beyond Chicken and Oatmeal Recipe Dry Puppy Food,https://s7d2.scene7.com/is/image/PetSmart/5326575,https://www.petsmart.ca/dog/food/dry-food/beyond-chicken-and-oatmeal-recipe-dry-puppy-food-5326575.html,Beyond Chicken and Oatmeal Recipe Dry Puppy Food,Beyond,4.6522,69,5,Food|Dry Food|,,dog,,,,,One Size
29.99,Zeal Air-Dried Dog Food - Beef,https://s7d2.scene7.com/is/image/PetSmart/5345439,https://www.petsmart.ca/dog/food/dry-food/zeal-air-dried-dog-food---beef-5345439.html,Zeal Air-Dried Dog Food - Beef,Zeal Canada,,0,5,Food|Dry Food|,,dog,,,1.0,Lb,1 Lb
31.99,"Halo Holistic Dry Dog Food - Wild-caught Salmon &amp; Whitefish, Digestive Care",https://s7d2.scene7.com/is/image/PetSmart/5340259,https://www.petsmart.ca/dog/food/dry-food/halo-holistic-dry-dog-food---wild-caught-salmon-and-whitefish-digestive-care-5340259.html,"Halo Holistic Dry Dog Food - Wild-caught Salmon &amp; Whitefish, Digestive Care",HALO,5.0,3,5,Food|Dry Food|,,dog,,,3.5,Lb,3.5 Lb
35.99,Royal Canin Breed Health Nutrition Dachshund Adult Dry Dog Food - Chicken,https://s7d2.scene7.com/is/image/PetSmart/5345500,https://www.petsmart.ca/dog/food/dry-food/royal-canin-breed-health-nutrition-dachshund-adult-dry-dog-food---chicken-5345500.html,Royal Canin Breed Health Nutrition Dachshund Adult Dry Dog Food - Chicken,Royal Canin,4.9074,108,5,Food|Dry Food|,,dog,,,2.5,Lb,2.5 Lb
33.99,Royal Canin Size Health Nutrition Small Aging 12+ Dog Food,https://s7d2.scene7.com/is/image/PetSmart/5345539,https://www.petsmart.ca/dog/food/dry-food/royal-canin-size-health-nutrition-small-aging-12%2B-dog-food-5345539.html,Royal Canin Size Health Nutrition Small Aging 12+ Dog Food,Royal Canin,5.0,17,5,Food|Dry Food|,,dog,,,2.5,Lb,2.5 Lb
27.99,"Nulo MedalSeries Puppy Dry Dog Food - High-Protein, Turkey, Chicken &amp; Duck",https://s7d2.scene7.com/is/image/PetSmart/5326102,https://www.petsmart.ca/dog/food/dry-food/nulo-medalseries-puppy-dry-dog-food---high-protein-turkey-chicken-and-duck-5326102.html,"Nulo MedalSeries Puppy Dry Dog Food - High-Protein, Turkey, Chicken &amp; Duck",Nulo,4.6923,26,5,Food|Dry Food|,,dog,,,4.0,Lb,4 Lb
89.99,"Blue Buffalo® Wilderness&amp;trade; Puppy Dry Dog Food - Natural, High Protein, Chicken",https://s7d2.scene7.com/is/image/PetSmart/5339257,https://www.petsmart.ca/dog/food/dry-food/blue-buffalo-wildernessandtrade-puppy-dry-dog-food---natural-high-protein-chicken-5339257.html,"Blue Buffalo&reg; Wilderness&amp;trade; Puppy Dry Dog Food - Natural, High Protein, Chicken",Blue Buffalo,4.6148,122,5,Food|Dry Food|,,dog,,,24.0,Lb,24 Lb
31.99,"Blue Buffalo® Wilderness&amp;trade; Senior Dry Dog Food - Natural, High Protein, Chicken",https://s7d2.scene7.com/is/image/PetSmart/5339250,https://www.petsmart.ca/dog/food/dry-food/blue-buffalo-wildernessandtrade-senior-dry-dog-food---natural-high-protein-chicken-5339250.html,"Blue Buffalo&reg; Wilderness&amp;trade; Senior Dry Dog Food - Natural, High Protein, Chicken",Blue Buffalo,4.7391,115,5,Food|Dry Food|,,dog,,,4.5,Lb,4.5 Lb
31.99,"Halo Holistic Dry Dog Food - Cage-free Chicken &amp; Brown Rice, Organic",https://s7d2.scene7.com/is/image/PetSmart/5340337,https://www.petsmart.ca/dog/food/dry-food/halo-holistic-dry-dog-food---cage-free-chicken-and-brown-rice-organic-5340337.html,"Halo Holistic Dry Dog Food - Cage-free Chicken &amp; Brown Rice, Organic",HALO,,0,5,Food|Dry Food|,,dog,,,3.5,Lb,3.5 Lb
89.99,"Blue Buffalo® Wilderness Senior Dry Dog Food - Chicken, High Protein, Wholesome Grains",https://s7d2.scene7.com/is/image/PetSmart/5339247,https://www.petsmart.ca/dog/food/dry-food/blue-buffalo-wilderness-senior-dry-dog-food---chicken-high-protein-wholesome-grains-5339247.html,"Blue Buffalo&reg; Wilderness Senior Dry Dog Food - Chicken, High Protein, Wholesome Grains",Blue Buffalo,4.7119,118,5,Food|Dry Food|,,dog,,,24.0,Lb,24 Lb
31.99,"Blue Buffalo® Wilderness&amp;trade; Small Breed Adult Dry Dog Food - Natural, High Protein, Chicken",https://s7d2.scene7.com/is/image/PetSmart/5339259,https://www.petsmart.ca/dog/food/dry-food/blue-buffalo-wildernessandtrade-small-breed-adult-dry-dog-food---natural-high-protein-chicken-5339259.html,"Blue Buffalo&reg; Wilderness&amp;trade; Small Breed Adult Dry Dog Food - Natural, High Protein, Chicken",Blue Buffalo,4.4916,238,5,Food|Dry Food|,,dog,,,4.5,Lb,4.5 Lb
52.99,Nulo MedalSeries All Life Stages Dry Dog Food - Salmon,https://s7d2.scene7.com/is/image/PetSmart/5280917,https://www.petsmart.ca/dog/food/dry-food/nulo-medalseries-all-life-stages-dry-dog-food---salmon-5280917.html,Nulo MedalSeries All Life Stages Dry Dog Food - Salmon,Nulo,4.7612,67,5,Food|Dry Food|,,dog,,,10.0,Lb,10 Lb
89.99,"Blue Buffalo® Wilderness&amp;trade; Adult Dry Dog Food - Natural, High Protein, Wholesome Grains, Duck",https://s7d2.scene7.com/is/image/PetSmart/5339256,https://www.petsmart.ca/dog/food/dry-food/blue-buffalo-wildernessandtrade-adult-dry-dog-food---natural-high-protein-wholesome-grains-duck-5339256.html,"Blue Buffalo&reg; Wilderness&amp;trade; Adult Dry Dog Food - Natural, High Protein, Wholesome Grains, Duck",Blue Buffalo,4.5551,254,5,Food|Dry Food|,,dog,,,24.0,Lb,24 Lb
89.99,"Blue Buffalo® Wilderness&amp;trade; Large Breed Adult Dry Dog Food - Natural, High Protein, Chicken",https://s7d2.scene7.com/is/image/PetSmart/5339246,https://www.petsmart.ca/dog/food/dry-food/blue-buffalo-wildernessandtrade-large-breed-adult-dry-dog-food---natural-high-protein-chicken-5339246.html,"Blue Buffalo&reg; Wilderness&amp;trade; Large Breed Adult Dry Dog Food - Natural, High Protein, Chicken",Blue Buffalo,4.6214,103,5,Food|Dry Food|,,dog,,,24.0,Lb,24 Lb
92.99,Nulo MedalSeries Large Breed Puppy Dry Dog Food - Salmon,https://s7d2.scene7.com/is/image/PetSmart/5305710,https://www.petsmart.ca/dog/food/dry-food/nulo-medalseries-large-breed-puppy-dry-dog-food---salmon-5305710.html,Nulo MedalSeries Large Breed Puppy Dry Dog Food - Salmon,Nulo,4.6984,63,5,Food|Dry Food|,,dog,,,24.0,Lb,24 Lb
105.99,"Instinct® Limited Ingredient Diet Adult Dry Dog Food - Grain Free, Raw, Salmon",https://s7d2.scene7.com/is/image/PetSmart/5266164,https://www.petsmart.ca/dog/food/dry-food/instinct-limited-ingredient-diet-adult-dry-dog-food---grain-free-raw-salmon-5266164.html,"Instinct&reg; Limited Ingredient Diet Adult Dry Dog Food - Grain Free, Raw, Salmon",Instinct,3.5263,19,5,Food|Dry Food|,,dog,,,20.0,Lb,20 Lb
99.99,Nulo MedalSeries Baked &amp; Brothy Large Breed Adult Dry Dog Food - Whitefish,https://s7d2.scene7.com/is/image/PetSmart/5339371,https://www.petsmart.ca/dog/food/dry-food/nulo-medalseries-baked-and-brothy-large-breed-adult-dry-dog-food---whitefish-5339371.html,Nulo MedalSeries Baked &amp; Brothy Large Breed Adult Dry Dog Food - Whitefish,Nulo,4.0,1,5,Food|Dry Food|,,dog,,,20.0,Lb,20 Lb
31.99,"Instinct® Raw Meals Freeze-Dried Puppy Dry Dog Food - Grain Free, Cage-Free Chicken",https://s7d2.scene7.com/is/image/PetSmart/5306032,https://www.petsmart.ca/dog/food/dry-food/instinct-raw-meals-freeze-dried-puppy-dry-dog-food---grain-free-cage-free-chicken-5306032.html,"Instinct&reg; Raw Meals Freeze-Dried Puppy Dry Dog Food - Grain Free, Cage-Free Chicken",Instinct,4.88,25,5,Food|Dry Food|,,dog,,,9.5,Oz,9.5 Oz
68.99,"Simply Nourish® Source Kibble + Adult Dry Dog Food - Salmon, High-Protein, Grain Free",https://s7d2.scene7.com/is/image/PetSmart/5286601,https://www.petsmart.ca/dog/food/dry-food/simply-nourish-source-kibble-%2B-adult-dry-dog-food---salmon-high-protein-grain-free-5286601.html,"Simply Nourish&reg; Source Kibble + Adult Dry Dog Food - Salmon, High-Protein, Grain Free",Simply Nourish,4.4878,41,5,Food|Dry Food|,,dog,,,22.0,Lb,22 Lb
31.99,"Wellness Core Digestive Health Senior Dry Dog Food - Hip &amp; Joint, Chicken",https://s7d2.scene7.com/is/image/PetSmart/5323090,https://www.petsmart.ca/dog/food/dry-food/wellness-core-digestive-health-senior-dry-dog-food---hip-and-joint-chicken-5323090.html,"Wellness Core Digestive Health Senior Dry Dog Food - Hip &amp; Joint, Chicken",Wellness,4.4819,83,5,Food|Dry Food|,,dog,,,4.0,Lb,4 Lb
31.99,Wellness Core Digestive Health Puppy Dry Dog Food - Chicken &amp; Brown Rice,https://s7d2.scene7.com/is/image/PetSmart/5322913,https://www.petsmart.ca/dog/food/dry-food/wellness-core-digestive-health-puppy-dry-dog-food---chicken-and-brown-rice-5322913.html,Wellness Core Digestive Health Puppy Dry Dog Food - Chicken &amp; Brown Rice,Wellness,4.75,88,5,Food|Dry Food|,,dog,,,4.0,Lb,4 Lb
76.99,Hill&#x27;s® Science Diet® Adult Dry Dog Food - Chicken &amp; Barley,https://s7d2.scene7.com/is/image/PetSmart/5286304,https://www.petsmart.ca/dog/food/dry-food/hills-science-diet-adult-dry-dog-food---chicken-and-barley-5286304.html,Hill's&reg; Science Diet&reg; Adult Dry Dog Food - Chicken &amp; Barley,Hill's Science Diet,4.7663,291,5,Food|Dry Food|,,dog,,,15.0,Lb,15 Lb
105.99,Instinct® Raw Boost® Whole Grain + Freeze-Dried All Life Stage Dry Dog Food,https://s7d2.scene7.com/is/image/PetSmart/5299130,https://www.petsmart.ca/dog/food/dry-food/instinct-raw-boost-whole-grain-%2B-freeze-dried-all-life-stage-dry-dog-food-5299130.html,Instinct&reg; Raw Boost&reg; Whole Grain + Freeze-Dried All Life Stage Dry Dog Food,Instinct,4.7143,14,5,Food|Dry Food|,,dog,,,20.0,Lb,20 Lb
80.99,Bil-Jac® Picky No More Medium and Large Breed Adult Dry Dog Food - Persnickety Recipe,https://s7d2.scene7.com/is/image/PetSmart/5266780,https://www.petsmart.ca/dog/food/dry-food/bil-jac-picky-no-more-medium-and-large-breed-adult-dry-dog-food---persnickety-recipe-5266780.html,Bil-Jac&reg; Picky No More Medium and Large Breed Adult Dry Dog Food - Persnickety Recipe,Bil-Jac,4.371,124,5,Food|Dry Food|,,dog,,,27.0,Lb,27 Lb
105.99,Instinct® Raw Boost® Whole Grain + Freeze-Dried All Life Stage Dry Dog Food,https://s7d2.scene7.com/is/image/PetSmart/5299126,https://www.petsmart.ca/dog/food/dry-food/instinct-raw-boost-whole-grain-%2B-freeze-dried-all-life-stage-dry-dog-food-5299126.html,Instinct&reg; Raw Boost&reg; Whole Grain + Freeze-Dried All Life Stage Dry Dog Food,Instinct,4.1053,19,5,Food|Dry Food|,,dog,,,20.0,Lb,20 Lb
31.99,"Instinct® Raw Meals Freeze-Dried Adult Dry Dog Food - Grain Free, Grass-Fed Lamb",https://s7d2.scene7.com/is/image/PetSmart/5306038,https://www.petsmart.ca/dog/food/dry-food/instinct-raw-meals-freeze-dried-adult-dry-dog-food---grain-free-grass-fed-lamb-5306038.html,"Instinct&reg; Raw Meals Freeze-Dried Adult Dry Dog Food - Grain Free, Grass-Fed Lamb",Instinct,4.5455,22,5,Food|Dry Food|,,dog,,,9.0,Oz,9 Oz
49.99,Pedigree Vitality+ Adult Hearty Beef and Vegetable Flavour Food For Dogs,https://s7d2.scene7.com/is/image/PetSmart/5328009,https://www.petsmart.ca/dog/food/dry-food/pedigree-vitality%2B-adult-hearty-beef-and-vegetable-flavour-food-for-dogs-5328009.html,Pedigree Vitality+ Adult Hearty Beef and Vegetable Flavour Food For Dogs,Pedigree,4.3571,14,5,Food|Dry Food|,,dog,,,,,One Size
39.99,"Instinct® Raw Boost All Life Stage Dry Dog Food - Natural, Grain Free, Freeze Dried Raw, Salmon",https://s7d2.scene7.com/is/image/PetSmart/5287062,https://www.petsmart.ca/dog/food/dry-food/instinct-raw-boost-all-life-stage-dry-dog-food---natural-grain-free-freeze-dried-raw-salmon-5287062.html,"Instinct&reg; Raw Boost All Life Stage Dry Dog Food - Natural, Grain Free, Freeze Dried Raw, Salmon",Instinct,4.4242,33,5,Food|Dry Food|,,dog,,,4.0,Lb,4 Lb
26.99,Simply Nourish Dry Puppy Food - Salmon &amp; Brown Rice,https://s7d2.scene7.com/is/image/PetSmart/5348524,https://www.petsmart.ca/dog/food/dry-food/simply-nourish-dry-puppy-food---salmon-and-brown-rice-5348524.html,Simply Nourish Dry Puppy Food - Salmon &amp; Brown Rice,Simply Nourish,5.0,2,5,Food|Dry Food|,,dog,,,5.0,Lb,5 Lb
92.99,"Purina Pro Plan Specialized Large Breed Adult Dry Dog Food - Joint Health, Chicken &amp; Rice",https://s7d2.scene7.com/is/image/PetSmart/5153712,https://www.petsmart.ca/dog/food/dry-food/purina-pro-plan-specialized-large-breed-adult-dry-dog-food---joint-health-chicken-and-rice-5153712.html,"Purina Pro Plan Specialized Large Breed Adult Dry Dog Food - Joint Health, Chicken &amp; Rice",Purina Pro Plan,4.5625,208,5,Food|Dry Food|,,dog,,,34.0,Lb,34 Lb
